title,story,url
블랙머니,"일명 서울지검 ‘막프로’! 검찰 내에서 거침없이 막 나가는 문제적 검사로 이름을 날리는 ‘양민혁’은 자신이 조사를 담당한 피의자가 자살하는 사건으로 인해 하루 아침에 벼랑 끝에 내몰린다. 억울한 누명을 벗기 위해 내막을 파헤치던 그는 피의자가 대한은행 헐값 매각사건의 중요 증인이었음을 알게 된다. 근거는 의문의 팩스 5장! 자산가치 70조 은행이 1조 7천억원에 넘어간 희대의 사건 앞에서 ‘양민혁’ 검사는 금융감독원, 대형 로펌, 해외펀드 회사가 뒤얽힌 거대한 금융 비리의 실체와 마주하게 되는데… 대한민국 최대의 금융스캔들, 사건은 아직 끝나지 않았다!",https://serieson.naver.com/v2/movie/335614
어바웃 타임,"모태솔로 팀(돔놀 글리슨)은 성인이 된 날, 아버지(빌 나이)로부터 놀랄만한 가문의 비밀을 듣게 된다. 바로 시간을 되돌릴 수 있는 능력이 있다는 것! 그것이 비록 히틀러를 죽이거나 여신과 뜨거운 사랑을 할 수 는 없지만, 여자친구는 만들어 줄 순 있으리.. 꿈을 위해 런던으로 간 팀은 우연히 만난 사랑스러운 여인 메리에게 첫눈에 반하게 된다. 그녀의 사랑을 얻기 위해 자신의 특별한 능력을 마음껏 발휘하는 팀. 어설픈 대시, 어색한 웃음은 리와인드! 뜨거웠던 밤은 더욱 뜨겁게 리플레이! 꿈에 그리던 그녀와 매일매일 최고의 순간을 보낸다. 하지만 그와 그녀의 사랑이 완벽해 질수록 팀을 둘러싼 주변 상황들은 미묘하게 엇갈리고, 예상치 못한 사건들이 여기저기 나타나기 시작하는데… 어떠한 순간을 다시 살게 된다면, 과연 완벽한 사랑을 이룰 수 있을까?",https://serieson.naver.com/v2/movie/56492
노팅 힐,"윌리엄 태커(휴 그랜트분)는 웨스트 런던의 ‘노팅 힐’에 사는 소심한 남자. 역시 독신의 괴상한 친구 스파이크(리스 아이판스 분)와 함께 살고있는 그는, 노팅힐 시장 한쪽 구석에 위치한 조그마한 여행서적 전문점을 운영하며 살고 있다. 그에게는 미래에 대한 포부나 설계는 사치에 불과하다. 여느 때와 마찬가지로 무미건조한 하루를 보내고 있던 그는 세계적으로 유명한 인기 영화배우 안나 스콧(줄리아 로버츠 분)이 그의 책방 문을 열고 들어와 책을 사고 나가자 잠깐 동안에 일어난 이 엄청난 사건에 어쩔 줄을 모른다. 몇분 뒤 오렌지 주스를 사서 돌아오던 그는 길 모퉁이를 돌던 안나와 부딪혀 그녀에게 주스를 모두 쏟고 만다. 윌리엄은 근처에 있는 그의 집으로 그녀를 안내하여 씻고 옷을 갈아 입도록 한다. 그리고 헤어지기 전에 받은 그녀의 갑작스런 키스를 잊지 못한다. 며칠 후 안나는 전화를 걸어 자신이 묵고 있는 호텔로 윌리엄을 초대 한다. 마침 기자와의 인터뷰 중이던 그녀는, 그녀의 매니저에 의해 기자로 오인 받은 그가 마주앉아 엉뚱한 질문들을 둘러대자 웃음을 터트린다. 그리고 매니저의 눈을 피해 윌리엄의 여동생 생일 파티에 함께 가기로 약속한다. 생일파티에 온 안나를 본 친구들은 그녀가 진짜 스타인 것을 한참 뒤에야 깨닫고 함성을 지른다. 파티 후 산책을 하던 안나와 윌리엄은 더욱 가까워지고 로맨틱한 분위기가 무르익을 즈음, 그녀는 그를 자신의 호텔로 데리고 올라간다. 하지만 그녀의 방에는 뜻밖에도 미국에서 갑자기 찾아온 그녀의 남자친구가 기다리고 있었고, 그녀가 어쭐 줄 모르자 윌리엄은 룸 서비스라고 얼버무린 후 돌아서 나온다. 그를 위로하려는 친구와 가족들의 노력에도 불구하고 그는 안나를 향한 그리움을 지울 수가 없는데. 반년이 지난 후 그녀가 윌리엄 앞에 갑자기 나타난다. 그녀가 무명시절 찍었던 장난스런 누드 사진들이 신문 1면에 공개되어 그녀의 인기는 물론 그녀 자신에게 커다란 상처를 준 사건이 발생한 다음날이었다. 윌리엄은 사건이 잠잠해질 때가지 그녀를 자신의 집에서 함께 지내도록 배려한다. 하지만 룸 메이트의 스파이크 때문에 이 소문이 노팅힐에 모두 퍼지고, 그녀와 윌리엄 사이의 관계를 대서 특필하러 몰려든 기자들을 보고 그녀는 배신감에 화를 내며 떠나 버린다. 그녀가 다음 영화 촬영차 노팅힐에 들른 것을 알게된 윌리엄은 그녀를 다시 찾아간다. 그녀와의 멋진 만남을 꿈꾸며 촬영이 끝나길 기다리던 그는 그녀가 그와의 사랑을 달갑지 않게 말하는 것을 우연히 듣고 그녀를 잊기로 결심한다. 윌리엄을 찾아온 안나는 그것이 오해였음을 말하고 자신의 사랑을 고백하지만, 윌리엄은 더 이상 그녀와의 차이를 극복할 자신이 없음을 말하고 그녀를 거절한다. 그러나 그녀가 영국을 떠나기 마지막 날 기자 회견장에 참석하고 있는 것을 들은 윌리엄은 자신의 사랑을 놓치지 않기 위해 회견장으로 달려가는데.",https://serieson.naver.com/v2/movie/129447
메가마인드,"메트로시티의 막강 라이벌 메트로맨과 메가마인드! 도시의 영웅 메트로맨과 달리 슈퍼 악당 메가마인드는 모든 사람들이 두려워하는 대상. 그러던 어느 날... 꼭 한번 메트로맨을 이기고 싶었던 메가마인드는 회심의 일격을 가하고 얼떨결에 메트로맨을 제거하는데 성공한다. 하지만 승리의 기쁨도 잠시! 앙숙이자, 숙적이자, 자신을 대적할 유일한 상대였던 메트로맨이 사라진 후 메가마인드는 예상치 못한 무료함에 점점 시들해져 가는데…",https://serieson.naver.com/v2/movie/234742
명탐정 코난: 할로윈의 신부,"극악무도한 폭파범 ‘플라먀’에 의해 교묘한 함정에 빠진 아무로 토오루! 모든 것이 베일에 가려진 ‘플라먀’, 유일한 단서는 아무로 토오루가 그의 경찰 동기들과 마지막으로 함께 했던 하루. 이와 동시에 결혼식의 신부가 된 경시청의 사토 형사는 불길한 예감을 감출 수 없는데… 도시 전체를 인질로 삼은 ‘플라먀’, 그리고 이를 막으려 하는 아무로 토오루와 명탐정 코난의 숨 막히는 공조! 다시 시작된 카운트다운, 할로윈의 밤이 광란으로 빛난다!",https://serieson.naver.com/v2/movie/540547
명탐정 코난: 비색의 탄환,"위험천만한 아카이 일가, 대집결! 그들이 모두 모일 때, 운명은 뒤바뀐다! 전 세계인의 축제 WSG(World Sports Games)의 개최를 앞둔 일본. 이를 기념해 시속 1,000km를 자랑하는 진공 초전도 리니어의 개통이 발표된다. 모두가 이를 주목하는 가운데, WSG의 공식 후원사 대표들이 연쇄 납치를 당하고, 코난은 이 사건이 15년 전 미국 보스턴에서 발생한 WSG 연쇄 납치 사건과 관련이 있다는 것을 밝혀내는데… 이를 지켜보는 아카이 슈이치와 FBI, 그리고 절대로 만나서는 안 될 위험천만한 가족이 모인다. 시속 1,000km로 질주하는 진공 초전도 리니어, 범인과의 목숨을 건 마지막 결판이 펼쳐진다!",https://serieson.naver.com/v2/movie/474794
극장판 명탐정 코난: 순흑의 악몽,"경찰에 잠입한 누군가에 의해 유출된 N.O.C리스트. 그리고 전 세계 스파이들이 연이어 제거되는 사건이 발생한다. 한편, 코난과 친구들은 새로 개장한 수족관에서 우연히 의문의 여인과 마주친다. 두 눈의 색이 다른 ‘오드아이’인 그녀는 상처투성이인 온 몸에, 자신의 이름도 기억하지 못하는 상태. 그녀가 잃어버린 기억을 되찾을 수 있게 도와 주던 코난은 심상치 않은 기운을 느끼고, FBI, 경찰, CIA가 모두 그녀를 쫓고 있음을 알게 된다. 여기에 베일에 싸여 있는 검은 조직마저도 정체를 드러내고 그 여인을 쫓는데… 잃어버린 기억 속 숨겨진 비밀을 찾아, 그들이 움직인다!",https://serieson.naver.com/v2/movie/153000
명탐정 코난: 진홍의 수학여행,"초등학생 코난이 아닌, 본래의 모습으로 교토 수학여행에 참가하게 된 고등학생 탐정 쿠도 신이치. 평범한 고등학생처럼 모리 란과 행복한 시간을 보내는 것도 잠시, 우연히 만난 배우 구라치 케이코의 부탁으로 의문의 암호 해독을 부탁받는다. 하지만 곧이어 그녀의 영화 제작 동료들을 둘러싼 연쇄 살인 사건이 일어난다. 범죄의 현장에는 요괴의 행적처럼 꾸며진 피 묻은 발자국과 팔손이 나뭇잎, 그리고 새로운 암호가 남겨져 있었는데… 천년 역사의 도시 교토, 요괴의 소행 같은 기묘한 연쇄 살인 사건의 진실은?! 그리고 쿠도 신이치♥모리 란, 두 사람의 마음은 맞닿을 수 있을까?",https://serieson.naver.com/v2/movie/424536
극장판 루팡 3세 VS 명탐정 코난,"은행 금고에 보관되어 있는 희귀 보석 ‘체리 사파이어’를 훔치겠다는 예고장이 경찰에 도착한다. 예고장의 장본인 루팡 3세는 추격을 따돌리고 결국 체리사파이어를 손에 넣는데 성공한다. 한편, 세계적 팝스타에게 날아든 의문의 협박편지. 범인을 찾던 코난 일행은 우연히’베스파니아 왕국 사건’ 때 만났던 루팡 3세의 파트너 알마로스가 에밀리오의 보디가드인 것을 보고, 그들이 무언가를 꾸미고 있다는 걸 직감한다. 공연 당일. 코난과 홍장미는 정체를 알 수 없는 자들에게서 체리 사파이어를 둘러싼 무서운 거래가 이루어 진다는 정보를 입수하고, 마침내, 루팡 3세 일당과 조대포 경감, 그리고 경찰들까지 움직이기 시작하는데… 과연, 루팡 3세 일당의 진짜 목적은 무엇이며, 코난은 그 계획을 저지할 수 있을 것인가?",https://serieson.naver.com/v2/movie/75748
이웃집 토토로,"도시를 떠나 시골로 이사 온 ‘사츠키’와 ‘메이’는 우연히 숲속에 살고 있는 신비로운 생명체 ‘토토로’를 만나 신비한 모험을 함께 한다. 그러던 어느 날, 어머니의 병원에서 위태로운 소식이 도착하고 언니 ‘사츠키’가 정신없이 아빠에게 연락을 취하는 와중에 ‘메이’가 행방불명 되는데…",https://serieson.naver.com/v2/movie/389497
하울의 움직이는 성,"어느 날, 영문도 모른 채 마녀의 저주로 인해 할머니가 된 소녀 '소피' 절망 속에서 길을 걷다가 거대한 마법의 성에 들어가게 된다. 그곳에서 자신과 마법사 하울의 계약을 깨주면 저주를 풀어주겠다는 불꽃악마 캘시퍼의 제안을 받고 청소부가 되어 ‘움직이는 성’에 머물게 되는데…",https://serieson.naver.com/v2/movie/400537
모노노케 히메(원령공주),"필사적으로 숲을 지키려는 대자연의 신들과 인간들과의 피할 수 없는 싸움이 시작된다. 숲과 산을 짓밟아 터전을 넓히려는 인간들과 그들의 야욕에 분노의 재앙신으로 변한 멧돼지를 비롯한 대자연과의 처절한 사투…그리고, 그 전쟁의 중심에서 자연의 편에 선 '모노노케 히메'와 그녀의 목숨을 구해 숲으로 들어온 ‘아시타카’…두 사람은 이제 어느 편에 설 지를 결정을 내려야만 하고 인간들은 최강의 군대를 동원하여 ‘시시’신의 숲으로 진격을 시작하는데…",https://serieson.naver.com/v2/movie/394821
바람계곡의 나우시카,"거대 산업 문명이 붕괴하고, 천년의 세월이 지난 후, 지구는 황폐해진 대지와 썩은 바다로 뒤덮혀 있으며 설상가상으로 부해(腐海: Buhae)라고 불리는 유독한 독기를 내뿜는 균류의 숲이 확장되면서 인류 제2의 종말을 예고하고 있다. 이제 지구상에 남은 건 독성의 균사를 내뿜는 곰팡이들과 '오무'과 같이 거대하게 변질된 곤충류들, 그리고 독을 품은 자연과 맞서 바람계곡에서처럼 여기저기 살아가는 극소수의 인간들뿐. 바닷가에서 불어오는 바람과 더불어 자연을 지배하려 들지 않고, 자연과 교감하며 공동체를 이루며 살아가는 나우시카와 마을 사람들은 퍼져가는 부해의 숲에 위협을 느끼면서도 나름대로의 생활을 영위해 나가고 있다. 그러던 어느 날, 악명 높은 군사국인 토르메키아 대형 비행선이 거대한 곤충들에게 습격을 당한 채 바람계곡에 추락하게 되고, 불타버린 비행선에는 괴상하게 생긴 붉은색의 거대한 알만이 꿈틀대고 있었다. 알의 정체에 대해 궁금해하던 마을 사람들에게 마을의 원로인 유파는 그 알은 불의 7일동안 지구의 모든 생명체를 태워버린 무시무시한 거신병의 알이고, 토르메키아는 거신병의 부활을 통해 다시 지구상에 자신들의 문명을 일으키려는 음모를 진행 중이었는 얘기를 들려준다. 얼마 지나지 않아 '거신병'의 알을 되찾으려는 '토르메키아' 함대가 바람 계곡으로 들이닥치고, '토르메키아'의 왕 '크사나'는 막강한 군사력을 바탕으로 순식간에 바람 계곡을 점령하게 된다. 자연을 정복하려 들 수록 자연은 인간을 용서하지 않는다는 사실을 알고 있는 나우시카는 앞으로 닥칠 무시무시한 일들을 예견하며 크사나를 설득하지만, 크사나는 이를 무시한 채 거신병의 부활을 추진시키며 나우시카를 인질로 삼아 함께 토르메키아국으로 돌아간다. 토르메키아로 돌아가던 중 크사나의 함대는 인근 국가인 페지테국 전투기의 습격을 받아 추락하고 나우시카는 페지테국의 아스벨과 함께 독을 내뿜는 포지식물 서식지의 중심으로 떨어진다. 그리고 거기에서 포자식물이 지구를 오염시키고 있는 것이 아니라 오히려 오염된 지구를 정화시켜 흙과 물을 깨끗이 만들고 있다는 비밀을 알게 된 나우시카는 마을로 돌아가 그 사실을 알리려하지만 이미 인간들은 거신병의 부활과 함께 자연과의 전쟁을 시작하고 바람 계곡에는 더이상 자연의 바람이 불지 않고 있었다. 화가 난 오무 무리와 곤충떼는 바람 계곡으로 몰려들고 인류가 살아갈 수 있는 유일한 길은 자연과의 친화 뿐이라는 사실을 알고 있는 나우시카는 자신이 처한 운명을 깨닫고 무섭게 돌진하는 거대한 오무 무리 앞에 자신의 몸을 던지는데...",https://serieson.naver.com/v2/movie/394827
천공의 성 라퓨타,"조용한 밤하늘에 한척의 비행선이 떠있다. 꼬리날개에 그려진 해골 마크가 이 배가 해적선이라는 사실을 말해주고 있다. 갑자기 사람들이 뛰어다니면서 기내가 부산스러워진다. 그들이 바라보는 곳에는 그 발밑으로 또다른 거대한 비행선 한척이 떠가고 있었다. 곧 해적선에 작은 비행정 몇 대가 발진한다. 거대한 비행선. 방 안에 한 소녀와 검은 양복에 선글라스의 두 남자가 있다. 한 남자가 소녀에게 식사를 가져오지만, 소녀는 아무말도 없이 고개를 돌려 버린다. 창밖을 바라보던 소녀는 이쪽으로 날아오고 있는 해적들의 비행정을 발견하게 된다. 곧 해적들의 습격이 시작된다. 해적들은 저항하는 선원들을 가볍게 제압하며 배안으로 침입한다. 검은 양복을 입은 남자 몇 명이 복도를 막고 해적과 총격전을 벌인다. 검은 양복의 우두머리로 보이는 듯한 남자가 그들에게 해적을 막을 것을 지시하고는 다시 방으로 들어와 어디엔가 무전연락을 시작한다. 그 모습을 바라보던 소녀는 식탁위에 쓰러져 있던 술병을 조용히 집어들어 그 남자를 내리친다. 소녀는 바닥에 쓰러진 남자의 품에서 목걸이를 빼내서 자신의 목에 건다. 곧 검은 양복의 남자들의 방어선이 뚫리고 해적들이 문을 부수고 들어온다. 바닥에 쓰러진 남자의 몸을 뒤지지만 아무것도 발견하지 못한다. 해적들은 창문이 열려있는 것을 발견하고는 창문 밖을 살핀다. 창문 밖에는 소녀가 비행선의 벽에 매달려있었다. 몸을 내밀어 소녀를 잡으려고 하는 해적들. 소녀를 보고 해적들의 우두머리가 외친다. ""저거다. 저 돌이다! 비행석이다!"" 해적들이 소녀를 잡으려는 순간 소녀는 비행선에서 떨어져 구름 밑으로 사라지고만다. 소녀는 정신을 잃은 채로 거꾸로 떨어지고 있었다. 소녀의 목걸이에서 파란 및이 뿜어져 나오더니, 소녀의 몸이 수평으로 유지되고, 천천히 떨어지게 된다. 한 광산마을. 파즈는 모처럼의 야근 때문에 야식을 사러 거리로 내려왔다. 파즈는 야식을 사서 돌아가던 도중 이상한 물체가 하늘에서 내려오고 있는 것을 보게된다. 떨어지는 것이 사람임을 알아챈 파즈. 그 사람은 파즈가 일하는 광산으로 떨어지고 있었다. 파즈는 그 사람이 내려오고 있는 장소로 달려가서 소녀가 떨어지기 전에 받아낸다. 파즈는 하늘에서 여자애가 내려왔다고 아저씨에게 말하려고 하지만, 기계가 말썽을 부리고, 탄광에 내려갔던 사람들이 돌아오고 하는 통에 말할 기회가 생기지 않는다. 아무에게도 얘기하지 못한채 잔업은 끝나고 파즈만이 혼자 남아서 뒷정리를 하게 된다. 밤하늘에 아까의 그 해적선이 떠있다.작은 비행정으로 아까의 습격에서 떨어져 버린 소녀를 찾고 있다. 하지만, 날이 어두워서 수색을 포기하고 다음날 다시 찾기로 한다. 다음날 아침 파즈는 부시시한 얼굴로 잠에서 깨어난다. 침대 위에서는 어제의 그 소녀가 잠자고 있었다. 아직 잠들어있는 소녀를 보면서 미소짓는 파즈. 파즈는 집 지붕위로 올라가서 새장에서 비둘기를 날려보낸 후 트럼펫을 분다. 잠에서 깨어난 소녀는 트럼펫 소리를 따라 지붕위로 올라온다. 시타가 자기가 어떻게 살았는지 궁금해하자, 파즈는 시타에게 그 목걸이를 잠시 달라고 한다. 그 목걸이는 시타의 집에서 예전부터 전해내려 오는 목걸이라 한다. 파즈는 목걸이를 메고 지붕에서 뛰어내린다. 놀라서 황급히 그쪽으로 달려가보는 시타. 바닥에는 벽돌을 뚫고 구멍이 생겨 버렸다. 둘은 다시 집 안으로 들어온다. 파즈는 시타에게 식사준비를 할 동안 씻고 있으라고 한다. 집안을 둘러보는 시타. 집 안에는 만들고 있는 비행기가 있었고, 벽에는 하늘에 떠있는 성의 그림이 있었다. 그림을 바라보고 있는 시타에게 파즈가 다가온다.",https://serieson.naver.com/v2/movie/389503
바다가 들린다,모리사키 타쿠는 도쿄의 대학생이다. 방학을 이용해 고향으로 돌아가는 비행기 속에서 그는 지난 2년 동안의 고교 시절을 떠올리게 된다. 도쿄로부터 타쿠의 학교로 뒤늦게 전학 온 무토 리카코가 그녀의 남부 사투리를 시대극의 배우 같다고 싫어하고 그녀의 반 학생들로부터 따돌림을 받음에도 불구하고 학교 내의 스타로서 자리를 굳히게 된다. 또한 그녀는 하와이로 간 수학여행에서 타쿠에게 돈을 잃어버렸다며 돈을 빌려 1년 전 부모님이 이혼한 후 만나지 못한 아버지를 만나러 도쿄로 갈수 있게 되는데....,https://serieson.naver.com/v2/movie/389491
붉은 돼지,"마르코 파곳(Captain Marco Pagot)는 1차세계 대전 중의 이태리 공군의 에이스 파이롯이었다. 하지만 그가 파시즘의 발호를 목도하고는 공군을 그만두고, 그의 의지대로 자유롭게 날고자 했다. 그는 국경의 헌터가 되었고, 포르코 롯소가 되었다. 그의 젊은 인간의 얼굴은 지나의 레스토랑의 벽에 걸려있는 사진 속에 유일하게 남아 있다. 미야자끼 말로는 포르코는 한때 지나와 결혼하러 했지만, 세계대전이 발발하였고, 지나는 오스트리아령의 섬에 살고 있었다. 공군장교로서 적국의 땅에서 결혼할 수 없었던 거란다. 애국심과 애정 사이에 고민하던 그는 결국 국가를 택했단다. 하지만 그가 그의 동료 파이럿의 죽음 - 지나의 남편을 포함하여 - 을 보자 그의 행동에 회의를 품게 된다. 국가를 위해 죽는 것에 대해. 그의 마음 속에서 불타 오르는 이러한 문제를 해결못하고 그는 돼지가 된 것이다.",https://serieson.naver.com/v2/movie/389495
이터널 선샤인,"조엘은 아픈 기억만을 지워준다는 라쿠나사를 찾아가 헤어진 연인 클레멘타인의 기억을 지우기로 결심한다. 기억이 사라져 갈수록 조엘은 사랑이 시작되던 순간, 행복한 기억들, 가슴 속에 각인된 추억들을 지우기 싫어지기만 하는데... 당신을 지우면 이 아픔도 사라질까요? 사랑은 그렇게 다시 기억된다.",https://serieson.naver.com/v2/movie/173863
이프 온리,"눈앞에서 사랑하는 연인을 잃은 남자는 다음 날 아침, 자신의 옆에서 자고 있는 연인을 보고 소스라치게 놀란다. 기쁨도 잠시, 정해진 운명은 바꿀 수 없단 것을 깨달은 그는 더 늦기 전에 자신의 진정한 사랑을 전하기로 마음먹는데… 네가 아니었다면 난 영영 사랑을 몰랐을 거야 사랑하는 법을 알게 해줘서 고마워, 사랑받는 법도.",https://serieson.naver.com/v2/movie/213081
엣지 오브 투모로우,"가까운 미래, 미믹이라 불리는 외계 종족의 침략으로 인류는 멸망 위기를 맞는다. 빌 케이지(톰 크루즈)는 자살 작전이나 다름없는 작전에 훈련이나 장비를 제대로 갖추지 못한 상태로 배정되고 전투에 참여하자마자 죽음을 맞는다. 하지만 불가능한 일이 일어난다. 그가 다시 그 끔찍한 날이 시작된 시간에 다시 깨어나 다시 전투에 참여하게 되고 다시 죽었다가 또 다시 살아나는 것. 외계인과의 접촉으로 같은 시간대를 반복해서 겪게 되는 타임 루프에 갇히게 된 것이다.",https://serieson.naver.com/v2/movie/71717
캐치 미 이프 유 캔,"전학 첫날 선생님으로 위장, 1주일 동안 전교생을 골탕먹인 당돌한 10대 프랭크(레오나르도 디카프리오 분) 부모의 이혼으로 무작정 가출한 프랭크는 본격적으로 남을 속이는 천재적 재능을 발휘하기 시작한다. 기자를 사칭해 항공사의 허점을 알아낸 프랭크. 그는 조종사로 위장, 모든 항공 노선에 무임승차는 물론 회사 수표를 위조해 전국 은행에서 140만 달러를 가로챈다. 하지만 꼬리가 길면 밟히는 법. 21년 경력의 FBI 최고의 요원 칼 핸러티가 프랭크의 뒤를 쫓고, 오랜 추적 끝에 드디어 혈혈단신 프랭크의 호텔방을 덮친 칼. 하지만 칼과 마주친 프랭크는 정부 비밀요원으로 둔갑, 증거물을 챙긴다며 위조수표를 챙겨 들고 여유롭게 빠져나온다. 뒤늦게 자신이 속았음을 깨달은 칼은 자존심 회복을 결심한다. 그리고 마침내 찾은 프랭크의 가족. 하지만 자신을 속인 프랭크가 겨우 17살의 고등학생이라는 사실에 또다시 칼의 자존심은 무너지고. 과연 칼은 프랭크를 잡을 수 있을까? 이들의 유쾌한 게임은 이제 시작이다.",https://serieson.naver.com/v2/movie/87816
터널,"자동차 영업대리점의 과장 정수(하정우), 큰 계약 건을 앞두고 들뜬 기분으로 집으로 가던 중 갑자기 무너져 내린 터널 안에 홀로 갇히고 만다. 눈에 보이는 것은 거대한 콘크리트 잔해뿐. 그가 가진 것은 78% 남은 배터리의 휴대폰과 생수 두 병, 그리고 딸의 생일 케이크가 전부다. 구조대는 오늘도 터널 안으로 들어오지 못했다. 대형 터널 붕괴 사고 소식에 대한민국이 들썩이고 정부는 긴급하게 사고 대책반을 꾸린다. 사고 대책반의 구조대장 대경(오달수)은 꽉 막혀버린 터널에 진입하기 위해 여러 가지 시도를 해보지만 구조는 더디게만 진행된다. 한편, 정수의 아내 세현(배두나)은 정수가 유일하게 들을 수 있는 라디오를 통해 남편에게 희망을 전하며 그의 무사생환에 대한 희망을 버리지 않는다. 지지부진한 구조 작업은 결국 인근 제2터널 완공에 큰 차질을 주게 되고, 정수의 생존과 구조를 두고 여론이 분열되기 시작한다.",https://serieson.naver.com/v2/movie/459751
