title,story,url
10일 안에 남자 친구에게 차이는 법,"Composure' 잡지의 칼럼니스트인 앤디 앤더슨 (케이트 허드슨 분)은 기사를 위해 특별한 임무를 해내야 한다. 여러가지 데이트 중의 실수로 남자에게 버림받는 여자들에 대한 모든 것들을 직접 경험하여 열흘 안에 기사로 만들어야 하는 것이다. 그녀의 임무는 다름아닌 '10일 안에 남자친구에게 차이는 법'에 대한 칼럼을 쓰는 것이다.
그녀가 할 일은 멋진 남자를 찾아, 그녀와 사랑에 빠지게 한 후, 갖은 방법으로 데이트를 망쳐 남자에게 차여야만 하는 것 이다. 앤디의 타겟으로는 불행하게도 잘나가는 광고 회사의 직원인 벤자민 벤 베리(매튜 맥커너히)가 선택된다. 그러나 그는 마침 다이아몬드 회사의 광고 피치를 따내기 위하여 광고주가 지목 하는 한 여성을 10일 안에 자신을 사랑 하도록 만들어야만 하는 상황이었다. 그리고 그 지목 받은 여성은 다름 아닌 칼럼니스트 앤디 앤더슨이다. 이제 이 둘은 각자가 맡은바 임무를 해내려는 그들의 첫 만남에서부터 엉뚱한 데이트가 이어지기 시작한다.10일 안에 만난 남자에게 버림 받아야 하는 앤디는 모든 남자들이 싫어하는 여자의 모습들을 벤자민에게 보여주며 차이기를 바라고, 벤자민은 반대로 앤디가 자신을 사랑 하도록 만들게 하기 위하여 그녀의 모든 행동을 참고 견디며 열흘을 버틴다. 그러나 인생은 뜻대로 되지 않는 법, 벤자민의 가족들을 만나 즐거운 시간을 보낸 앤디는 그에게 진실한 사랑의 감정을 조금씩 느끼게 되고 벤자민 또한 광고를 따내기 위한 내기이기 보다 진심으로 그녀와의 데이트를 즐기며 그녀를 조금씩 사랑 하게 된다. 그러나 이 둘은 서로에 대한 진심을 알기도 전에 그들의 서로 다른 속내를 알아버리게 되고...",https://serieson.naver.com/v2/movie/88571
1987,"1987년 1월, 경찰 조사를 받던 스물두 살 대학생이 사망한다. 증거인멸을 위해 박처장(김윤석)의 주도 하에 경찰은 시신 화장을 요청하지만, 사망 당일 당직이었던 최검사(하정우)는 이를 거부하고 부검을 밀어붙인다. 단순 쇼크사인 것처럼 거짓 발표를 이어가는 경찰. 그러나 현장에 남은 흔적들과 부검 소견은 고문에 의한 사망을 가리키고, 사건을 취재하던 윤기자(이희준)는 ‘물고문 도중 질식사’를 보도한다. 이에 박처장은 조반장(박희순)등 형사 둘만 구속시키며 사건을 축소하려 한다. 한편, 교도소에 수감된 조반장을 통해 사건의 진상을 알게 된 교도관 한병용(유해진)은 이 사실을 수배 중인 재야인사에게 전달하기 위해 조카인 연희(김태리)에게 위험한 부탁을 하게 되는데… 한 사람이 죽고, 모든 것이 변화하기 시작했다. 모두가 뜨거웠던 1987년의 이야기.",https://serieson.naver.com/v2/movie/222221
극장판 짱구는 못말려 1기 - 액션가면 vs 그래그래 마왕,"아이들은 액션가면을 TV 속의 인물인줄만 알고 동경한다. 짱구는 친구들과 함께 액션 가면 카드를 사모으며 즐거운 하루를 보낸다. 드디어 여름방학이 시작되는데, 아버지가 갑자기 바다로 놀러가자고 한다. 그것은 지구를 지키는 액션가면이 그들을 바다로 유인해낸 것이다. 한편, 우주에서 온 그래그래 마왕은 지구를 지배하기 위해 사람들의 영혼을 빼앗아간다. 짱구는 지구를 지키기 위해 액션가면과 힘을 합치는데…",https://serieson.naver.com/v2/movie/495122
극비수사,"한 아이가 유괴된 후, 수사가 시작되고 아이 부모의 특별 요청으로 담당이 된 공길용 형사는 아이를 보호하기 위해 극비수사를 진행하기로 한다. 한편, 가족들은 유명한 점술집을 돌아다니며 아이의 생사여부를 확인하지만 이미 아이가 죽었다는 절망적인 답만 듣게 되고, 마지막으로 도사 김중산을 찾아간다. 아이의 사주를 풀어보던 김도사는 아직 아이가 살아있고, 보름 째 되는 날 범인으로부터 첫 연락이 온다고 확신한다. 보름째 되는 날, 김도사의 말대로 연락이 오고, 범인이 보낸 단서로 아이가 살아있음을 확신한 공형사는 김도사의 말을 믿게 된다. 하지만 한 달이 지나도록 수사는 진전되지 않고, 모두가 아이의 생사 보다 범인 찾기에 혈안이 된 상황 속에 공형사와 김도사 두 사람만이 아이를 살리기 위한 수사를 계속 진행하는데…",https://serieson.naver.com/v2/movie/385027
나의 특별한 형제,"비상한 두뇌를 가졌지만 동생 ‘동구’ 없이는 아무 데도 못 가는 형 ‘세하’(신하균), 뛰어난 수영실력을 갖췄지만 형 ‘세하’ 없이는 아무것도 못 하는 동생 ‘동구’(이광수).이들은 피 한 방울 섞이지 않았지만 20년 동안 한 몸처럼 살아온 ‘특별한 형제’다. 어느 날 형제의 보금자리 ‘책임의 집’을 운영하던 신부님이 돌아가시자 모든 지원금이 끊기게 되고, 각각 다른 장애를 가진 두 사람은 헤어질 위기에 처하고 만다. 세하는 ‘책임의 집’을 지키고 동구와 떨어지지 않기 위해 구청 수영장 알바생이자 취준생 ‘미현’(이솜)을 수영코치로 영입하고, 동구를 수영대회에 출전시켜 사람들의 이목을 집중시키는 데 성공한다. 헤어지지 않을 수 있다는 희망을 본 것도 잠시, 예상치 못한 인물이 형제 앞에 등장하면서 형제는 새로운 위기를 겪게 되는데...!",https://serieson.naver.com/v2/movie/85017
극장판 짱구는 못말려 2기 - 부리부리 왕국의 보물,"우연히 시장에서 경품 추첨에 응모한 짱구와 짱구 엄마는 특별상에 당첨된다. 특별상의 내용은 부리부리 왕국 5박6일 가족여행권! 하지만 이 여행은 악당 화이트 스네이크단이 꾸민 무시무시한 음모였다. 이런 사실을 모른 채 짱구 가족은 부리부리 왕국으로 여행을 떠나고, 비행기 안에서부터 악당들의 맹렬한 추격전이 시작된다. 무슨 이유에선지 화이트 스네이크단은 짱구를 잡아가려고 하고, 엎치락뒤치락하는 접전 끝에 결국 짱구는 잡힌다. 한편 짱구가 잡혀간 화이트 스네이크단의 지하 감옥에는 짱구와 똑같이 생긴 부리부리 왕국의 왕자, 찡구가 갇혀 있었다. 알고 보니 부리부리 왕국의 엄청난 보물과 함께 부리부리 왕국을 통째로 집어삼키려는 아나콘다의 계획에는 짱구와 찡구가 모두 필요했던 것! 과연 짱구는 악당의 손에서 무사히 빠져나올 수 있을까...?",https://serieson.naver.com/v2/movie/495123
극장판 짱구는 못말려 13기- 부리부리 3분 대작전,"어느 날, 정신없이 아침을 보낸 후, 엄마는 고픈 배를 채우기 위해 컵라면을 준비해둔다. 3분을 기다리던 중 엄마는 잠에 빠져들고, 라면 냄새를 따라 온 미래맨이 짱구 집에 나타나게 된다. 결국 엄마에게 들키게 된 미래맨은 자신의 모든 상황을 다 얘기하고 짱구 가족의 도움을 받기로 한다. 3분 뒤의 미래에서 괴물을 이겨 원래 있던 세계로 보내주는 역할을 맡은 짱구 가족은 미래맨의 도움으로 영웅이 되어 괴물을 처리한다. 그러던 어느 날, 괴물이라고는 하지만 그다지 강하지 않았던 탓에 늘 자신만만했던 엄마와 아빠는 3분 안에 괴물을 처리하지 못하고 오히려 다쳐서 오는데...",https://serieson.naver.com/v2/movie/496931
나 홀로 집에,"크리스마스 시즌의 시카고. 말썽꾸러기라 집안 가족들로부터 욕을 듣고 따돌림 당하는 케빈은 늘 자신은 혼자 살거라면서 가족들이 모두 없어졌으면 좋겠다고 생각한다. 자기의 치즈 피자를 먹은 형과 싸워 소동을 일으키자 엄마는 케빈을 3층 다락방으로 올려보낸다. 케빈의 가족들과 케빈의 집에 온 손님들은 다음 날에 크리스마스 연휴를 이용해 프랑스의 친척 집으로 떠날 계획이었다. 그날 밤, 바람이 세차게 불어 전화선과 전기선이 끊긴다. 케빈의 가족들은 늦잠을 자게 되어 비행기 시간을 맞추기 위해 허둥대다가 그만 3층 다락방에서 잠이 든 케빈을 두고 떠난다. 잠에서 깬 케빈은 혼자 남은 것을 알고 하느님이 자신의 소원을 들어주었다고 기뻐한다. 비행기를 타고 가던 케빈의 어머니는 무엇인가 빠뜨린 기분에 고민하다가 케빈을 두고 왔음에 놀란다. 하지만 전화선이 불통이라, 어쩔 수 없다가 프랑스에 도착한 식구들은 목적지로 가고 엄마는 케빈이 걱정이 되어 집으로 돌아갈 비행기표를 사기 위해 안간힘을 쓰지만 연말연휴라 좌석이 없었다.혼자 집에 남은 케빈은 형과 누나 방을 구경하면서 즐거워한다. 그리고 노래를 부르고 트리도 만들면서 자축한다. 그런데 빈집털이 2인조 도둑이 케빈의 집을 호시탐탐 노리고 있다는 것을 알게 되는데...",https://serieson.naver.com/v2/movie/72559
기묘한 가족,"망해버린 주유소의 트러블메이커 가장 '만덕'은 우연히 만난 좀비를 집안에 들인다. 여타 좀비와 달리 반반한 외모, 말귀 알아듣는 ‘쫑비’를 보며 저마다의 속셈으로 패밀리 비즈니스를 꿈꾸는 가족. 리더인 맏며느리 '남주'를 중심으로 행동대장 장남 '준걸'과 브레인 차남 '민걸' 에너지 담당 막내 '해걸'에 물리면 죽기는커녕 더 젊어지는 좀비 '쫑비'까지! 이들의 기막힌 비즈니스는 조용했던 동네를 별안간 혈기 왕성한 마을로 만들어버리는데... 이거 혹시… 우리 때문이야?",https://serieson.naver.com/v2/movie/341238
미스터 주: 사라진 VIP,"국가정보국 에이스 요원 태주. 특사로 파견된 VIP 경호 임무를 수행하던 중, 갑작스러운 사고로 VIP는 사라지고 설상가상 온갖 동물들의 말이 들리기 시작한다. 갑자기 이상한 행동을 하는 태주를 의심하는 민국장과 만식을 뒤로 하고,태주는 군견 알리와 함께 VIP를 찾아 나서는데…Very. Important. Panda!도심 한복판, 사라진 VIP를 찾기 위한 인간과 동물들의 역대급 팀플레이가 시작된다!",https://serieson.naver.com/v2/movie/463866
로스트 인 런던,"90년대 최고의 전성기를 구가하던 할리우드 스타 우디 해럴슨. 하지만, 최근에는 ‘퇴물’로 취급받으며 ‘최악의 무대’에 서는 게 전부. 오늘도 연극 무대를 마치고 남은 하루 가족과 오붓한 시간을 보내기로 한다. 하지만, 가장 사랑하는 아내와 싸움을 하게 되고, 엎친 데 덮친 격 폭행 사건에 연루되면서 철장 신세를 지게 된 우디 해럴슨. 오늘 하루의 끝은 해피엔딩이 될 수 있을까?",https://serieson.naver.com/v2/movie/195926
너의 이름은.,"꿈 속에서 몸이 뒤바뀐 도시 소년 ‘타키’와 시골 소녀 ‘미츠하’, 만난 적 없는 두 사람이 만들어가는 기적과 사랑에 관한 이야기 <너의 이름은.> 잊고 싶지 않은 사람 잊으면 안 되는 사람 너의 이름은?",https://serieson.naver.com/v2/movie/563981
슈퍼 마리오 브라더스,따단-딴-따단-딴 전 세계를 열광시킬 올 타임 슈퍼 어드벤처의 등장! 뉴욕의 평범한 배관공 형제 '마리오'와 ‘루이지’는 배수관 고장으로 위기에 빠진 도시를 구하려다 미스터리한 초록색 파이프 안으로 빨려 들어가게 된다. 파이프를 통해 새로운 세상으로 차원 이동하게 된 형제. 형 '마리오'는 뛰어난 리더십을 지닌 '피치'가 통치하는 버섯왕국에 도착하지만 동생 '루이지'는 빌런 '쿠파'가 있는 다크랜드로 떨어지며 납치를 당하고 ‘마리오’는 동생을 구하기 위해 ‘피치’와 ‘키노피오’의 도움을 받아 '쿠파'에 맞서기로 결심한다. 그러나 슈퍼스타로 세상을 지배하려는 그의 강력한 힘 앞에 이들은 예기치 못한 위험에 빠지게 되는데...! 동생을 구하기 위해! 세상을 지키기 위해! '슈퍼 마리오'로 레벨업 하기 위한 '마리오'의 스펙터클한 스테이지가 시작된다!,https://serieson.naver.com/v2/movie/532557
극장판 짱구는 못말려: 수수께끼! 꽃피는 천하떡잎학교,"명문 엘리트 양성학교에 체험 입학하게 된 짱구와 친구들!
좋은 성적을 내서 학교에 정식 입학하고 싶은 철수와 장난만 치려는 짱구는 크게 싸우게 된다.그러던 중 학교에 도는 괴소문의 존재 ‘흡덩귀’에게 철수가 엉덩이를 물린 채 발견된다.‘흡덩귀’에게 엉덩이를 물리면 엘리트 학생도 모지리로 변하게 되는데….철수와 학생들을 구하기 위해 짱구와 떡잎마을 방범대 친구들은 탐정 동아리를 결성하고 수사를 시작한다!범인은 과연 누구? 짱구는 사건을 해결하고 철수와의 우정을 지킬 수 있을까?!",https://serieson.naver.com/v2/movie/389486
마녀 배달부 키키,"완벽한 마녀가 되기 위한 초보마녀 키키의 특급 배달 작전이 시작된다!마녀인 엄마와 인간인 아빠 사이에서 태어난 소녀 '키키'는 13살이 되던 만월의 어느 밤, 검은 고양이 '지지'와 함께 마녀 수행을 떠난다. 불안한 비행으로 첫 출발한 '키키'는 갑작스런 폭우에 비를 피하기 위해 기차에 숨어들고 이른 아침 기차 밖으로 보이는 넓은 바다 근처 항구도시를 보고 앞으로 이곳에서 살기로 결심한다.
비행 능력으로 마을 이곳 저곳의 배달 일을 도맡게 된 '키키'는 이제 어느 덧 마을에도 익숙해져 가고 배달 일 역시 재밌게 느껴진다. 그러던 어느 날 '키키'는 갑자기 마법 능력을 잃게 되고 급기야 하나 뿐인 마법 지팡이마저 부러지게 된다. 과연 '키키'는 마법의 힘을 되찾고 진정한 마녀가 될 수 있을 것인가?",https://serieson.naver.com/v2/movie/549876
장화신은 고양이: 끝내주는 모험,"아홉 개의 목숨 중 단 하나의 목숨만 남은 장화신은 고양이. 마지막 남은 목숨을 지키기 위해 히어로의 삶 대신 반려묘의 삶을 선택한 그에게 찾아온 마지막 기회, 바로 소원을 들어주는 소원별이 있는 곳을 알려주는 지도! 잃어버린 목숨을 되찾고 다시 히어로가 되기를 꿈꾸는 장화신은 고양이는 뜻밖의 동료가 된 앙숙 파트너 '키티 말랑손', 그저 친구들과 함께 라면 모든 게 행복한 강아지 '페로'와 함께 소원별을 찾기 위해 길을 떠난다. 그리고 소원별을 노리는 또 다른 빌런들과 마주치게 되는데… 새해를 여는 끝내주는 모험이 시작된다!",https://serieson.naver.com/v2/movie/530117
극장판 주술회전 0,"어릴 적 소꿉친구인 오리모토 리카를 교통사고로 눈앞에서 잃은 옷코츠 유타. “약속해, 리카와 유타는 어른이 되면 결혼하기로” 옷코츠는 원령으로 변한 리카의 저주에 괴로워한 나머지, 자신도 죽기를 바라지만 최강의 주술사인 고죠 사토루에 의해 주술고전에 들어가게 된다. 그리고 동급생인 젠인 마키, 이누마키 토게, 판다를 만나면서 굳은 결심을 한다.“살아도 된다는 자신감이 필요해” “나는 주술고전에서 리카의 저주를 풀겠습니다”한편, 옷코츠와 친구들 앞에 과거에 일반인을 대량으로 학살해서 고전에서 추방된 최악의 주저사인 게토 스구루가 나타난다. “12월 24일, 우리는 백귀야행을 결행한다” 주술사만의 낙원을 만들려는 게토는 비술사를 섬멸하겠다면서, 신주쿠와 교토에 천의 저주를 내리는데…과연 옷코츠는 게토를 막을 수 있을까? 그리고 리카의 저주를 풀 수 있을까?",https://serieson.naver.com/v2/movie/530118
프린스 앤 프린세스,"
소심하고 겁이 많지만 용기를 내서 111개의 다이아몬드를 찾아 공주의 마법을 푸는 왕자. 싱싱한 무화과의 맛과 바보스러우리만치 순수한 소년의 정성에 감복해버린 거만한 여왕. 군중들의 비웃음에 개의치 않고 차분히 때를 기다리다가 멋쟁이 마녀와 사랑에 빠지는 청년. 어리석은 도둑을 통쾌하게 넉아웃 시키는 가공할 다리 힘의 노파. 메가 레이더 살인을 즐기는 미래 여왕과 그녀의 잔인함 속에 짙게 드리워진 고독을 치유해준 파블로 조련사. 황당한 마법의 키스로 인해 개구리, 나비, 코뿔소, 코끼리, 애벌레, 사마귀, 거북이, 벼룩, 기린, 고래, 황소로 변신해가는 왕자와 공주의 불길한 키스의 전주곡 등.",https://serieson.naver.com/v2/movie/554733
스파이더맨: 뉴 유니버스,"평범한 10대 ‘마일스 모랄레스’는 우연히 방사능 거미에 물려 스파이더맨 능력을 가지게 된다. 혼란스러워하던 ‘마일스’는 악당과 싸우고 있는 ‘피터 파커’를 마주치게 되고 ‘피터 파커’는 ‘마일스’가 자신과 같은 능력을 가지고 있음을 직감한다. 여러 개의 평행세계가 존재한다는 것을 알게 된 ‘마일스’와 ‘피터 파커’는 이후 스파이더우먼 ‘스파이더 그웬’, ‘스파이더맨 누아르’, ‘스파이더햄’ 등 평행세계 속 공존하는 모든 스파이더맨들을 만나게 되는데…하나의 유니버스에서 만나 팀을 결성한 스파이더맨들은 과연 세계를 구할 수 있을까?스파이더맨들의 새로운 시대가 열린다!",https://serieson.naver.com/v2/movie/494145
태일이,"평화시장에서 재단사 보조로 취직한 태일이는 정식 재단사가 되어 가족의 생계도 꾸리고 동생들 공부도 시키는 것이 꿈이다.그러나 열심히 일해 재단사가 된 태일이의 눈에 띈 것은 죽도록 일하고 커피 한 잔 값도 받지 못한 채 피를 토하는 어린 여공들의 얼굴이다.동료를 위하는 따뜻한 마음 만으로는 아무것도 바꿀 수 없고, ‘근로기준법’이 있어도 지켜지지 않는 현실 앞에서 스물두 살 청년 태일이는 스스로 희망의 불꽃이 되기를 결심한다. “근로기준법을 준수하라! 우리는 기계가 아니다!”",https://serieson.naver.com/v2/movie/400531
귀를 기울이면,"중학교 3학년 시즈쿠는 평소 책을 많이 읽는 소녀이다. 여름방학, 매번 도서카드에서 먼저 책을 빌려간 세이지란 이름을 발견하고 호기심을 갖는다. 어느 날 아버지의 도시락을 전해주러 가는 길. 지하철 안에서 혼자 탄 고양이를 보게 된다. 신기하게 여긴 시즈쿠는 고양이를 따라가다 골동품가게에 들어가게 되고, 그곳에서 주인 할아버지와 손자를 보게 된다. 그 손자는 다름 아닌 아마사와 세이지, 사춘기의 두 사람은 점차 서로의 사랑에 대해 알게 된다. 시즈쿠는 바이올린 장인을 자신의 장래로 확실히 정한 세이지를 보면서 자신의 꿈과 미래를 진지하게 고민하게 된다. 그 후 이탈리아 연수를 간 세이지가 돌아 올 때까지 작가가 되고자 도전해 보기로 하고 소설을 쓰게 된다.",https://serieson.naver.com/v2/movie/373896
날씨의 아이,"비가 그치지 않던 어느 여름날, 가출 소년 ‘호다카’는 수상한 잡지사에 취직하게 되고 비밀스러운 소녀 ‘히나’를 우연히 만난다.“지금부터 하늘이 맑아질 거야” 그녀의 기도에 거짓말 같이 빗줄기는 멈추고,사람들의 얼굴에 환한 빛이 내려온다.“신기해, 날씨 하나에 사람들의 감정이 이렇게나 움직이다니”하지만, 맑음 뒤 흐림이 찾아오듯 두 사람은 엄청난 세계의 비밀을 마주하게 되는데…흐리기만 했던 세상이 빛나기 시작했고, 그 끝에는 네가 있었다.",https://serieson.naver.com/v2/movie/1165
인크레더블,"보이지 않는 곳에서 악의 무리들을 일망타진하는 세계 최강의 슈퍼히어로 ""미스터 인크레더블"" 그러나 은퇴한지 벌써 15년! 전성기 때 ‘몸짱’에서 ‘몸꽝’이 되어버린 그의 불룩 나온 배는 이제 초강력 허리띠조차 튕겨 내버린다. 그런 그에게 정체불명의 특명이 떨어진다. 출동할 곳은 본토와 아득히 떨어진 섬, 특명을 내린 사람을 알 수 없는 1급 비밀작전. 평범한 시민 ""미스터 인크레더블""은 다시 빛나는 영웅으로 복귀 할 수 있을 것인가.",https://serieson.naver.com/v2/movie/557239
원피스 필름 레드,"오직 목소리 하나로 전 세계를 사로잡은 디바 ‘우타’. 그녀가 모습을 드러내는 첫 라이브 콘서트가 음악의 섬 ‘엘레지아’에서 열리고 ‘루피’가 이끄는 밀짚모자 해적단과 함께 수많은 ‘우타’ 팬들로 공연장은 가득 찬다. 그리고 이 콘서트를 둘러싼 해적들과 해군들의 수상한 움직임이 시작되는데…드디어 전세계가 애타게 기다리던 ‘우타’의 등장과 함께 노래가 울려 퍼지고, 그녀가 ‘샹크스의 딸’이라는 충격적인 사실이 드러난다.‘루피’, ‘우타’, ‘샹크스’, 세 사람의 과거가 그녀의 노랫소리와 함께 밝혀진다!",https://serieson.naver.com/v2/movie/323257
토이 스토리 4,"장난감의 운명을 거부하고 떠난 새 친구 ‘포키’를 찾기 위해 길 위에 나선 ‘우디’는 우연히 오랜 친구 ‘보핍’을 만나고 그녀를 통해 새로운 세상에 눈을 뜨게 된다. 한편, ‘버즈’와 친구들은 사라진 ‘우디’와 ‘포키’를 찾아 세상 밖 위험천만한 모험을 떠나게 되는데…",https://serieson.naver.com/v2/movie/496917
짱구는 못말려: 어른제국의 역습!!,"20세기를 그리워하는 사람이 현재의 21세기 일본은 감정도 없고 메마른 곳이라며 현재의 일본을 20세기 되돌려 놓으려한다. 그래서 짱구네 가족이 자신들의 미래를 찾기 위해 이를 막아내고 다시 일본은 원래대로 돌아온다는 이야기. 어느날 일본에 '20세기 박물관' 이라는 곳이 생겨 어른들이 어릴 때 추억을 감상할 수 있게 되어있었다. 그런데, 그곳에서 TV로 어른들을 아이들처럼 만드는 세뇌 광고를 내보내, 어른들은 아이들을 내팽개치고 박물관으로 계속 놀러가서 영영 돌아오지 않았다. 그것은 바로 20세기를 그리워하는 조직인 'yesterday once more' 의 행각. 리더인 켄과 그의 애인 챠코는, 지금 이 세상을 전부 20세기 때 그대로로 만들고자 했다. 기다리다 못한 신 짱, 토루, 마사오, 네네, 보오, 히마와리, 시로는 20세기 박물관으로 쳐들어가 어른들을 구출해내고, 사랑하는 가족들과 함께 하기 위해 미래를 손에 넣는 도전을 한다. 그러나, 지금은 신 짱의 부모님과 어른들은 신 짱을 공격하는 적이 되어 있었다.",https://serieson.naver.com/v2/movie/222959
코코,뮤지션을 꿈꾸는 소년 미구엘은 전설적인 가수 에르네스토의 기타에 손을 댔다 ‘죽은 자들의 세상’에 들어가게 된다. 그리고 그곳에서 만난 의문의 사나이 헥터와 함께 상상조차 못했던 모험을 시작하게 되는데…과연 ‘죽은 자들의 세상’에 숨겨진 비밀은? 그리고 미구엘은 무사히 현실로 돌아올 수 있을까?,https://serieson.naver.com/v2/movie/496928
극장판 짱구는 못말려 10기 - 태풍을 부르는 장엄한 전설의 결투,"어느 날 밤 짱구 가족은 동시에 사극에서 본 듯한 아름다운 여성이 나오는 꿈을 꾼다. 다음 날 짱구가 유치원에서 돌아오자 흰둥이가 마당의 흙을 파헤쳐 놓는 사건이 발생하는데, 그 구덩이에서 나온 문서엔 서툰 글씨로 자기가 떡잎성에 있다는 내용이 적혀 있었다. 문서를 읽어나가던 짱구는 굉장히 아름다운 아가씨가 있다는 내용에서 지난 밤의 꿈을 회상하는데, 문득 정신을 차려 보니 꿈에서 본 호숫가에 서 있는 것이 아닌가…",https://serieson.naver.com/v2/movie/41927
슈퍼배드,각 나라를 대표하는 명소들을 한 번에 훔쳐버린 기상천외한 주인공 ‘그루’. 그는 세계 최고의 악당이 되기 위하여 다른 사람이 절대 훔칠 수 없는 것을 하나 훔치기로 마음 먹는다. 그것은 바로 ‘달’!!! ‘달’을 훔치기 위한 최신식 장비를 구하기 위해 어쩔 수 없이 고아원의 세 소녀들을 맡게 된 ‘그루’는 세 소녀들과 함께 살게 되면서 세상에서 가장 어려운 일은 악당이 되는 것이 아니라 바로 이 소녀들을 키우는 일임을 알게 된다. 소녀들에 의해 점차 사랑을 배우고 변화되어 가는 ‘그루’. 과연 그는 달을 훔칠 수 있을 것인가? 소녀들과 그루는 어떻게 될 것인가,https://serieson.naver.com/v2/movie/107360
