title,story,url
극장판 짱구는 못말려 17기 - 포효하라! 떡잎 야생왕국,"짱구가 사는 떡잎마을에서는 새로운 마을 회장으로 취임한 나자연을 중심으로 환경보호운동이 왕성하게 펼쳐진다. 어느 날, 짱구는 떡잎유치원의 야외수업으로 지역청소활동에 참가한다. 그리고 강가에서 발견한 이상한 가방 안에 들어 있던 초록색 음료를 가지고 집으로 돌아온다. 그날 밤, 짱구의 아빠와 엄마가 그 음료를 마시고, 다음날, 두 사람은 서서히 동물 같은 행동을 한다. 그러다 결국 아빠는 닭, 엄마는 표범으로 변신한다. 깜짝 놀라는 짱구의 가족 앞에 ‘분리’란 남자가 이끄는 정체 모를 집단이 나타나서 짱구의 가족들을 잡아간다. 그런 와중에 짱구의 앞에는 ‘빅토리아’라는 이름의 여성이 나타나서 나자연의 정체를 말해준다. 나자연은 과격한 환경보호단체의 단장으로, 인간을 동물로 만들어 환경파괴를 저지할 계획을 추진하고 있다는 것이다. 그리고 짱구의 엄마와 아빠가 마신 것은 인간을 동물로 바꾸는 음료로, 그 음료를 마신 사람은 이윽고 자신이 인간이었던 사실조차 잊어버리게 된다... 짱구는 엄마, 아빠를 구하기 위해 적의 본부로 침입하는데... 짱구는 과연 엄마와 아빠를 구하고, 그들의 야망을 저지할 수 있을까?",https://serieson.naver.com/v2/movie/498449
교섭,"분쟁지역 아프가니스탄에서 한국인들이 탈레반에게 납치되는 최악의 피랍사건이 발생한다. 교섭 전문이지만 아프가니스탄은 처음인 외교관 재호(황정민)가 현지로 향하고, 국정원 요원 대식(현빈)을 만난다. 원칙이 뚜렷한 외교관과 현지 사정에 능통한 국정원 요원. 입장도 방법도 다르지만, 두 사람은 인질을 살려야 한다는 목표를 향해 함께 나아간다. 살해 시한은 다가오고, 협상 상대, 조건 등이 시시각각 변하는 상황에서 교섭의 성공 가능성은 점점 희박해져 가는데…",https://me2.do/5oita0Ny
극장판 짱구는 못말려 6기 - 돼지발굽 대작전,"원장님은 복권에 당첨되자 유치원 아이들을 유람선에 태워 파티를 즐긴다. 그런데 이때 웬 여성이 물에서 올라와 이들의 배로 올라탄다. 정의의 편 LOVE, 약칭 JPL의 요원인 그녀는 암호명 ‘깜찍이’로, 세계를 지배하려는 악의 무리 ‘돼지발굽’이 개발한 무기의 주요 부품을 그들의 비행선 안에서 훔쳐 나오다 적에게 들키자 지상으로 뛰어내렸던 것이다. 그녀를 뒤쫓아 온 돼지발굽이 그녀가 탄 배를 송두리째 들어 올리자 원장 선생님과 아이들은 바다로 뛰어들지만 화장실에 가 있던 짱구와 친구들과 깜찍이만은 배에 남아 있다가 돼지발굽에게 붙잡히는 신세가 된다. 한편 짱구가 실종됐다는 뉴스에 애태우는 엄마, 아빠 앞에 JPL의 또다른 요원 ‘덩치’가 나타나 짱구를 찾아주겠다며 사진을 요청하자, 엄마 아빠는 ‘덩치’을 따라가서 짱구를 찾기로 마음먹는데...",https://serieson.naver.com/v2/movie/495127
카트,"“안녕하십니까 고객님. 행복한 하루 되십시오 고객님.” 대한민국 대표 마트 ‘더 마트’. “마트의 생명은 매출, 매출은 고객, 고객은 서비스”를 외치며 언제나 고객 만족 서비스를 실천하기 위해 온갖 컴플레인과 잔소리에도 꿋꿋이 웃는 얼굴로 일하는 ‘더 마트’의 직원들. 그러던 어느 날, 회사로부터 갑작스럽게 일방적인 해고 통지를 받게 된다. “회사가 잘 되면 저희도 잘 될 줄 알았습니다. 오늘 우리는 해고 되었습니다.” 정규직 전환을 눈 앞에 둔 선희(염정아)를 비롯, 싱글맘 혜미(문정희), 청소원 순례(김영애), 순박한 아줌마 옥순(황정민), 88만원 세대 미진(천우희)은 하루 아침에 직장을 잃을 위기에 처한다. 노조의 ‘노’자도 모르고 살았던 그녀들이 용기를 내어 서로 힘을 합치는데… 아무것도 몰랐던 그들의 뜨거운 싸움이 시작된다!",https://me2.do/xhAG8JkX
명량,"1597년 임진왜란 6년, 오랜 전쟁으로 인해 혼란이 극에 달한 조선. 무서운 속도로 한양으로 북상하는 왜군에 의해 국가존망의 위기에 처하자 누명을 쓰고 파면 당했던 이순신 장군(최민식)이 삼도수군통제사로 재임명된다. 하지만 그에게 남은 건 전의를 상실한 병사와 두려움에 가득 찬 백성, 그리고 12척의 배 뿐. 마지막 희망이었던 거북선마저 불타고 잔혹한 성격과 뛰어난 지략을 지닌 용병 구루지마(류승룡)가 왜군 수장으로 나서자 조선은 더욱 술렁인다.330척에 달하는 왜군의 배가 속속 집결하고압도적인 수의 열세에 모두가 패배를 직감하는 순간,이순신 장군은 단 12척의 배를 이끌고 명량 바다를 향해 나서는데…! 12척의 조선 vs 330척의 왜군 역사를 바꾼 위대한 전쟁이 시작된다!",https://me2.do/5Obr9d8G
아이언맨,"천재적인 두뇌와 재능으로 세계 최강의 무기업체를 이끄는 CEO이자, 타고난 매력으로 셀러브리티 못지않은 화려한 삶을 살아가던 억만장자 토니 스타크. 아프가니스탄에서 자신이 개발한 신무기 발표를 성공리에 마치고 돌아가던 그는 게릴라군의 갑작스런 공격에 의해 가슴에 치명적인 부상을 입고 게릴라군에게 납치된다. 가까스로 목숨을 건진 그에게 게릴라군은 자신들을 위한 강력한 무기를 개발하라며 그를 위협한다. 그러나 그는 게릴라군을 위한 무기 대신, 탈출을 위한 무기가 장착된 철갑수트를 몰래 만드는 데 성공하고, 그의 첫 수트인 ‘Mark1’를 입고 탈출에 성공한다. 미국으로 돌아온 토니 스타크는 자신이 만든 무기가 많은 사람들의 생명을 위협하고, 세상을 엄청난 위험에 몰아넣고 있다는 사실을 깨닫고 무기사업에서 손 뗄 것을 선언한다. 그리고,  ark1을 토대로 최강의 하이테크 수트를 개발하는 데 자신의 천재적인 재능과 노력을 쏟아 붓기 시작한다. 탈출하는 당시 부서져버린 Mark1를 바탕으로 보다 업그레이드 된 수트 Mark2를 만들어낸 토니 스타크. 거기에 만족하지 않고, 숱한 시행착오와 실패 끝에 자신의 모든 능력과 현실에서 가능한 최강의 최첨단 과학 기술이 집적된 하이테크 수트 Mark3를 마침내 완성, 최강의 슈퍼히어로 ‘아이언맨’으로 거듭난다. 토니 스타크가 탈출하는 과정을 통해 Mark1의 가공할 위력을 확인한 게릴라 군은 토니 스타크가 미처 회수하지 못한 Mark1의 잔해와 설계도를 찾아낸다. Mark1을 재조립하여 그들의 목적을 이루기 위한 거대하고 강력한 철갑수트를 제작하려는 음모를 꾸미는 게릴라군. 토니 스타크가 갖고 있던 에너지원을 훔쳐 ‘아이언맨’을 능가하는 거대하고 강력한 ‘아이언 몽거’를 완성한 그들은 세계 평화를 위협하고, 토니 스타크는 그들의 음모과 배후세력이 누구인지를 알게 되는데...!",https://serieson.naver.com/v2/movie/43995
아바타(리마스터링),"가까운 미래, 지구는 에너지 고갈 문제를 해결하기 위해 머나먼 행성 판도라에서 대체 자원을 채굴하기 시작한다. 하지만 판도라의 독성을 지닌 대기로 인해 자원 획득에 어려움을 겪게 된 인류는 판도라의 토착민 ‘나비(Na’vi)’의 외형에 인간의 의식을 주입, 원격 조종이 가능한 새로운 생명체 ‘아바타’를 탄생시키는 프로그램을 개발한다. 한편, 하반신이 마비된 전직 해병대원 ‘제이크 설리(샘 워딩튼)’는 ‘아바타 프로그램’에 참가할 것을 제안 받아 판도라에 위치한 인간 주둔 기지로 향한다. 그 곳에서 자신의 ‘아바타’를 통해 자유롭게 걸을 수 있게 된 ‘제이크’는 자원 채굴을 막으려는 ‘나비(Na’vi)’의 무리에 침투하라는 임무를 부여 받는다. 임무 수행 중 ‘나비(Na’vi)’의 여전사 ‘네이티리(조 샐다나)’를 만난 ‘제이크’는 그녀와 함께 다채로운 모험을 경험하면서 ‘네이티리’를 사랑하게 되고, ‘나비(Na’vi)’들과 하나가 되어간다. 하지만 머지 않아 전 우주의 운명을 결정 짓는 대규모 전투가 시작되면서 ‘제이크’는 최후의 시험대에 오르게 되는데….행성 판도라와 지구의 피할 수 없는 전쟁! 이 모든 운명을 손에 쥔 제이크의 선택은?",https://serieson.naver.com/v2/movie/70246
상견니,"
2009년, 리쯔웨이와 황위쉬안은 밀크티 가게에서 우연히 재회한다. 처음 만났지만 마치 오래전부터 알고 있었던 것 같은 기시감과 묘한 설렘을 느끼는 두 사람. 이들은 사계절을 함께 보내며 가까워지고, 2010년의 마지막 날, 함께 새해를 맞이하며 연인이 된다. 2017년, 황위쉬안의 인생에 예상치 못한 변화가 생긴다. 해외 발령을 받게 된 것. 황위쉬안은 이 제안을 받아들이고 새로운 여정을 시작하지만 이 선택은 그녀의 미래를 바꿀 뿐만 아니라, 리쯔웨이와 모쥔제, 그리고 그녀가 아직 모르는 천윈루의 운명까지 뒤바꿔 놓는데… 이제, 이들은 수없이 뒤엉킨 타임라인 속에서 서로를 구하기 위해 낡은 테이프 속 들려오는 노래 ‘라스트 댄스’를 따라 달려가기 시작한다.",https://serieson.naver.com/v2/movie/559941
해리 포터와 불사조 기사단,"
길고도 지루한 여름 날 호그와트 마법학교 다섯 번째 해를 기다리고 있는 해리포터(다니엘 래드클리프). 이모부 더즐리 식구들과 참고 사는 것도 지겨운데다 친구 론(루퍼트 그린트)과 헤르미온느(엠마 왓슨)에게서는 편지 한 통 오지 않는다. 그러던 중 예상치 못했던 편지 한 장이 도착한다. 그것은 해리가 학교 밖인 리틀 위닝에서 얄미운 사촌 두들리, 즉 머글 앞에서 디멘터들의 공격을 막는 마법을 사용했기 때문에 호그와트 마법학교에서 퇴학 당하게 되었다는 소식이었다. 앞이 캄캄한 해리. 갑자기 어둠의 마법사 러들이 나타나 해리를 불사조 기사단의 비밀 장소로 데리고 간다. 시리우스(게리 올드만)를 위시한 불사조 기사단을 만난 해리는 과거, 부모님들의 활약상을 알게 되어 힘을 얻고, 자신을 퇴학시키기 위해 마법부 장관 코넬리우스 퍼지(로버트 하디)가 법정에 세우지만 덤블도어 교장(마이클 갬볼 경)의 중재 덕분에 무죄 판결까지 받는다. 하지만 예언자 일보는 볼드모트(랄프 파인즈)가 돌아왔다는 해리의 말이 새빨간 거짓말이라며 비난하고 학생들 역시 해리를 의심하며 따돌린다. 게다가 자신이 가장 힘들어 할 때 도움을 주던 덤블도어 교장까지도 이유 없이 해리를 멀리하고…. 한편, 덤블도어도 못마땅한데 해리의 퇴학마저 무산이 되자 마법부 장관은 ‘어둠의 마법방어술’ 과목에 돌로레스 엄브릿지(이멜다 스털톤)를 교수로 임명한다. 하지만 엄브짓지의 마법방어술 수업은 학생들이 어둠의 힘으로부터 스스로를 지켜내기는커녕 오히려 곤경에 빠지게 한다. 이에 헤르미온느와 론은 해리의 능력을 믿고 자칭 ‘덤블도어의 군대’라고 명명한 비밀단체를 조직한다. 해리는 어둠의 마법에 맞서 스스로를 지켜낼 수 있는 방법을 학생들에게 가르쳐주며 앞으로 닥칠 격전에 대비시킨다.그러나 밤마다 불길한 사건을 예견하는 악몽에 시달리는 해리. 이제 볼드모트와의 대결이 머지 않았음을 느끼게 된다. 시리우스가 공격 당하는 악몽을 꾼 해리는 덤블도어 군대와 함께 마법부 미스터리 부서 예언의 방으로 향한다. 그리고 이어 나타난 죽음을 먹는 자들…. 빛의 마법과 어둠의 마법간의 불꽃 튀는 대결 해리포터와 불사조 기사단, 호그와트의 운명이 그들에게 달렸다!",https://serieson.naver.com/v2/movie/2145
레디 플레이어 원,"2045년, 암울한 현실과 달리 가상현실 오아시스(OASIS)에서는 누구든 원하는 캐릭터로 어디든지 갈 수 있고, 뭐든지 할 수 있고 상상하는 모든 게 가능하다. 웨이드 와츠(타이 쉐리던) 역시 유일한 낙은 대부분의 사람들이 하루를 보내는 오아시스에 접속하는 것이다.  어느 날 오아시스의 창시자인 괴짜 천재 제임스 할리데이(마크 라이런스)는 자신이 가상현실 속에 숨겨둔 3개의 미션에서 우승하는 사람에게 오아시스의 소유권과 막대한 유산을 상속한다는 유언을 남기고, 그가 사랑했던 80년대 대중문화 속에 힌트가 있음을 알린다. 제임스 할리데이를 선망했던 소년 ‘웨이드 와츠’가 첫 번째 수수께끼를 푸는 데 성공하자 이를 저지하기 위해 현실에서 살인도 마다하지 않는 ‘IOI’라는 거대 기업이 뛰어든다. 모두의 꿈과 희망이 되는 오아시스를 지키기 위해서는 반드시 우승해야 한다! 그리고 우승을 위해서는 가상현실이 아닌 현실세계의 우정과 사랑의 힘이 필요하기만 한데…",https://serieson.naver.com/v2/movie/231089
매트릭스,"인간의 기억을 지배하는 가상현실, 매트릭스 2199년. 인공 두뇌를 가진 컴퓨터(AI: Artificial Intelligence)가 지배하는 세계에서 인간을 가축처럼 인공 자궁(子宮: 인큐베이터)에서 재배해 에너지원으로 활용하는 끔찍한 시대다. AI에 의해 뇌세포에 ‘매트릭스’라는 프로그램(내용은 1999년의 가상 현실)을 입력당한 인간은, 매트릭스 프로그램에 따라 평생  999년의 가상 현실을 살아간다. 프로그램 안에 있는 동안 인간의 뇌는 AI의 철저한 통제를 받는다. 인간이 보고 느끼는 것들은 항상 그들의 검색 엔진에 노출되어 있고, 인간의 기억 또한 그들에 의해 입력되고 삭제된다. 그러나, 이러한 가상 현실 속에서 진정한 현실을 인식할 수 있는 인간은 없다. 매트릭스 밖은 가상 현실의 꿈에서 깨어난 유일한 인간들이 생존해 있는 곳.한편, AI의 인큐베이터에서 탈출해 인류의 구원자를 찾아나선 사람들이 있는데, 바로 모피스(Morpheus: 로렌스 피쉬번 분)를 리더로 한 일단의 해커들. 그들은 광케이블을 통해 매트릭스에 침투하고 매트릭스 프로그램을 응용해 자신들의 뇌 세포에 각종 데이터를 입력한다. 그들의 당면 목표는 인류를 구원할 영웅을 찾아내는 것. 그들은 AI 통제 요원들의 삼엄한 검색망을 뚫고 매트릭스 안에 들어가 드디어 오랜 동안 찾아헤매던 ‘그’를 발견한다. ‘그’는 유능한 컴퓨터 프로그래머, 토머스 앤더슨(Thomas Anderson: 키누 리브스 분). 낮에는 평범한 회사원으로 살아가지만, 밤마다 네오(Neo)라는 이름으로 컴퓨터 해킹에 나서는 그는 모피스와 그의 동료인 매혹적인 여인 트린(Trinity: 캐리-앤 모스 분)에게서 조심스레 매트릭스에 대한 단서를 얻는다. 알 수 없는 두려움 속에서 매트릭스의 실체를 추적해 나가는 네오는 마침내 또다른 숨겨진 세계, 매트릭스 밖의 우주를 만나 가상 현실의 꿈에서 깨어난다. 그리고 AI에게 양육되고 있는 인간의 비참한 현실을 확인하고 매트릭스를 탈출한 네오는 모피스의 도움으로 컴퓨터 프로그램 훈련을 통해 사이버 전사로 거듭난다. 한편, 모피스의 동료 중 사이퍼(Cypher: 죠 팬토리아노 분)는 끊임없는 기계들의 위협과 공격으로 인한 두려움을 견디지 못하고, 다시 매트릭스 안의 가상 현실로 들어가기 위해 동료들을 배신한다. 네오와 모피스 일행이 매트릭스 안에 잠입한 사이, 사이퍼는 광케이블을 교란시켜 그들이 매트릭스에서 빠져나올 출구를 봉쇄해 버리자, 네오 일행은 엄청난 괴력을 지닌 해커 제거반과 사투를 벌인다.",https://serieson.naver.com/v2/movie/2093
해리 포터와 혼혈 왕자,"어둠의 세력이 더욱 강력해져 머글 세계와 호그와트까지 위협해온다. 위험한 기운을 감지한 덤블도어 교수는 다가올 전투에 대비하기 위해 해리 포터와 함께 대장정의 길을 나선다. 볼드모트를 물리칠 수 있는 유일한 단서이자 그의 영혼을 나누어 놓은 7개의 호크룩스를 파괴하는 미션을 수행해야만 하는 것! 또한 덤블도어 교수는 호크룩스를 찾는 기억여행에 결정적 도움을 줄 슬러그혼 교수를 호그와트로 초청한다. 한편 학교에서는 계속된 수업과 함께 로맨스의 기운도 무르익는다. 해리는 자신도 모르게 지니에게 점점 끌리게 되고, 새로운 여자 친구가 생긴 론에게 헤르미온느는 묘한 질투심을 느끼는데... 남겨진 결전을 위한 최후의 미션, 볼드모트와 해리 포터에 얽힌 치명적인 비밀, 선택된 자만이 통과할 수 있는 대단원을 향한 본격적인 대결이 시작된다!",https://serieson.naver.com/v2/movie/2134
해리 포터와 죽음의 성물,"모든 것을 끝낼 최후의 전투! 판타지의 아름다운 역사가 드디어 마침표를 찍는다! 덤블도어 교장이 남긴 ‘죽음의 성물’의 단서를 쫓던 해리 포터는 볼드모트가 그토록 찾아 다닌 절대적인 힘을 가진 지팡이의 비밀을 통해 드디어 마지막 퍼즐을 완성한다. 볼드모트의 영혼이 담긴 다섯 번째 ‘호크룩스’를 찾기 위해 마법학교 호그와트로 돌아온 해리와 친구들은 그들을 잡으려는 보안마법에 걸려 위기를 맞지만 덤블도어의 동생인 에버포스의 도움으로 벗어난다. 그리고 그에게서 덤블도어와 어둠의 마법사 그린델왈드에 관한 놀라운 과거에 대해 알게 된다. 한편, 볼드모트는 해리에 의해 호크룩스들이 파괴되었음을 느끼고 호그와트로 향한다. 해리를 주축으로 한 불사조 기사단과 죽음을 먹는 자들 간의 마법전투가 벌어지고 여기에 거대거미 아크로맨투라와 거인족 등 마법 생물들이 볼드모트 편으로 가세하면서 호그와트는 거대한 전쟁터로 변한다. 전쟁의 틈에서 해리는 덤블도어를 죽인 스네이프의 엄청난 비밀과 볼드모트를 죽일 마지막 호크룩스에 대한 단서를 알게 되는데...",https://serieson.naver.com/v2/movie/8259
신과함께-죄와 벌,"저승 법에 의하면, 모든 인간은 사후 49일 동안 7번의 재판을 거쳐야만 한다.살인, 나태, 거짓, 불의, 배신, 폭력, 천륜7개의 지옥에서 7번의 재판을 무사히 통과한 망자만이 환생하여 새로운 삶을 시작할 수 있다. “김자홍 씨께선, 오늘 예정 대로 무사히 사망하셨습니다”화재 사고 현장에서 여자아이를 구하고 죽음을 맞이한 소방관 자홍, 그의 앞에 저승차사 해원맥과 덕춘이 나타난다. 자신의 죽음이 아직 믿기지도 않는데 덕춘은 정의로운 망자이자 귀인이라며 그를 치켜세운다. 저승으로 가는 입구, 초군문에서 그를 기다리는 또 한 명의 차사 강림, 그는 차사들의 리더이자 앞으로 자홍이 겪어야 할 7개의 재판에서 변호를 맡아줄 변호사이기도 하다. 염라대왕에게 천년 동안 49명의 망자를 환생시키면 자신들 역시 인간으로 환생시켜 주겠다는 약속을 받은 삼차사들, 그들은 자신들이 변호하고 호위해야 하는 48번째 망자이자 19년 만에 나타난 의로운 귀인 자홍의 환생을 확신하지만, 각 지옥에서 자홍의 과거가 하나 둘씩 드러나면서 예상치 못한 고난과 맞닥뜨리는데…누구나 가지만 아무도 본 적 없는 곳, 새로운 세계의 문이 열린다!",https://serieson.naver.com/v2/movie/368994
스타워즈 에피소드 5 - 제국의 역습,"{아주 먼 옛날 은하계 저편에...(A long time ago in a galaxy far, far away...)} {반란군(Rebellion)으로써는 암담한 시기. 죽음의 별(Death Star)을 파괴하는 데는 성공하였지만, 제국군(Imperial)은 반란군을 은하계 막다른 곳으로 몰아냈다. 루크 스카이워커(Luke Skywalker)가 이끄는 자유의 투사(Freedom Fighters)들은 제국의 무서운 스타함대(Starfleet)을 피하여 얼음으로 뒤덮인 호스(Hoth) 행성에 새로운 비밀 기지를 마련했다. 젊은 스카이워커를 찾으려고 혈안이 된 간악한 악의 군주(Evil Lord) 다스 베이더(Darth Vader) 총통은 우주의 구석 구석에 수천의 원격조종 탐색선(Remote Probes)을 보냈다.} 비록 죽음의 별은 폭파시켰지만, 수와 무기에 있어서 열세인 반란군은 제국군에게 밀려서 우주의 변방인 얼음의 혹성에서 재기의 기회를 노리고 있었다. 정찰에 나섰다가 얼음속에 사는 괴물에게 납치되어 다시 구출되는 과정에서 루크는 제다이 기사단의 스승 요다를 찾아가 제다이 수업을 받으라는 지시를 받는다. 스카이워커를 찾으려는 제국은 우주의 곳곳에 탐색 장치를 떨어뜨려놓는데, 결국 얼음의 혹성이 제국에게 발각된다. 마침내 거대한 다리로 걸어다니는 마치 불을 뿜는 공룡과 같은 스노우 워커를 앞세운 제국의 반격이 개시된다. 우세한 제국에 밀린 반란군은 직결 지점에서 만나기로 하고 뿔뿔이 흩어진 채로 간신히 퇴각에 성공한다. 루크는 제다이 기사이자 철학자이면서 8백살이 넘는 나이를 가진 요다가 있는 습지대의 혹성 다고바로 가서 그에게서 철저한 훈련을 받으며 제다이로서의 기량을 갖추고자 애쓴다. 한편, 자바를 찾아 떠나려다 실종되었던 루크를 구출하느라 머물고 있던 솔로는 레이아 공주가 기지에 갇히는 바람에 퇴각하는 수송선에 오르지 못하자, 그녀를 데리고 겨우 팰콘에 오른다. 하지만 미쳐 팰콘의 고속 추진기를 고치지못한 관계로 광속을 낼 수 없어 제국의 끈질긴 추적을 계속 받는다. 제국의 추적에 위험이 계속되는 솔로 일행은 우주의 온갖 암석들이 밀집된 소혹성군(Asteroid)으로 들어가 뒤쫓아오는 제국의 추적기 4대 중 2대가 암석과 부딪쳐 폭발된다. 그리고 다시, 거대한 암석의 계곡으로 들어가 납작한 팰콘과 좁은 지형을 이용, 뒤따라오던 나머지 두 대도 폭발시킨다. 그리고 그 별의 구멍 속으로 피신한다. 그곳에서 팰콘을 수리하지만 무언가 이상함을 느낀 솔로는 자신이 착륙한 곳이 바로 동굴에 사는 뱀처럼 생긴 거대한 우주 괴물의 입 속이었다. 간신히 괴물에게서 탈출하지만, 다시 끈질기게 암석들을 부수며 별무리속을 뚫고 쫓아오는 제국 함대의 공격을 받자 솔로는 기지를 발휘, 함대에 뒷편에 붙어서 숨는다. 그리고 그의 예상대로 함대가 광속 추진을 하기전 쓰레기를 버릴 때 함께 떨어져 나온다. 함대는 광속으로 순간적으로 멀리 가고, 솔로는 근처에 있는 옛 친구 랜도 칼리시안이 관리하는 구름의 도시를 찾아가는데.",https://serieson.naver.com/v2/movie/94713
