title,story,url
연애 빠진 로맨스,"일도 연애도 마음대로 되지 않는 스물아홉 ‘자영’(전종서).  전 남친과의 격한 이별 후 호기롭게 연애 은퇴를 선언했지만 참을 수 없는 외로움에 못 이겨 최후의 보루인 데이팅 어플로 상대를 검색한다. 일도 연애도 호구 잡히기 일쑤인 서른셋 ‘우리’(손석구). 뒤통수 제대로 맞은 연애의 아픔도 잠시 편집장으로부터 19금 칼럼을 떠맡게 되고 데이팅 어플에 반강제로 가입하게 된다. 그렇게 설 명절 아침! 이름, 이유, 마음 다 감추고 만난 ‘자영’과 ‘우리’. 1도 기대하지 않았지만, 1일 차부터 둘은 서로에게 급속도로 빠져들게 되고 연애인 듯 아닌 듯 미묘한 관계 속에 누구 하나 속마음을 쉽게 터놓지 못하는데... 이게 연애가 아니면 도대체 뭔데? 발 빼려다 푹 빠졌다!",https://serieson.naver.com/v2/movie/477584
듄,"10191년, 아트레이데스 가문의 후계자인 폴(티모시 샬라메)은 시공을 초월한 존재이자 전 우주를 구원할 예지된 자의 운명을 타고났다. 그리고 어떤 계시처럼 매일 꿈에서 아라키스 행성에 있는 한 여인을 만난다. 모래언덕을 뜻하는 '듄'이라 불리는 아라키스는 물 한 방울 없는 사막이지만 우주에서 가장 비싼 물질인 신성한 환각제 스파이스의 유일한 생산지로 이를 차지하기 위한 전쟁이 치열하다. 황제의 명령으로 폴과 아트레이데스 가문은 죽음이 기다리는 아라키스로 향하는데… 위대한 자는 부름에 응답한다, 두려움에 맞서라, 이것은 위대한 시작이다!",https://serieson.naver.com/v2/movie/471011
"오늘 밤, 세계에서 이 사랑이 사라진다 해도","“카미야 토루에 대해 잊지 말 것” 자고 일어나면 전날의 기억을 잃는 ‘선행성 기억상실증’에 걸린 소녀 ‘마오리’ “내일의 마오리도 내가 즐겁게 해줄 거야"" 누구에게도 기억되지 않는 무색무취의 평범한 소년 ‘토루’ 매일 밤 사랑이 사라지는 세계, 그럼에도 불구하고, 다음 날 서로를 향한 애틋한 고백을 반복하고 두 소년, 소녀의 가장 슬픈 청춘담",https://serieson.naver.com/v2/movie/552430
윤희에게,"평범한 일상을 살아가던 '윤희' 앞으로 도착한 한 통의 편지. 편지를 몰래 읽어본 딸 '새봄'은 편지의 내용을 숨긴 채 발신인이 살고 있는 곳으로 여행을 제안하고, '윤희'는 비밀스러웠던 첫사랑의 기억으로 가슴이 뛴다. '새봄'과 함께 여행을 떠난 ‘윤희’는 끝없이 눈이 내리는 그곳에서
첫사랑을 만날지도 모른다는 기대를 품는데…",https://serieson.naver.com/v2/movie/335790
너의 결혼식,"고3 여름, 전학생 ‘승희’(박보영)를 보고 첫눈에 반한 ‘우연’(김영광). 승희를 졸졸 쫓아다닌 끝에 마침내 공식커플로 거듭나려던 그때! 잘 지내라는 전화 한 통만 남긴 채 승희는 사라져버리고, 우연의 첫사랑은 그렇게 막을 내리는 듯했다. 1년 뒤, 승희의 흔적을 쫓아 끈질긴 노력으로 같은 대학에 합격한 우연. 그런데 그의 앞을 가로막은 건… 다름 아닌 그녀의 남.자.친.구! 예술로 빗나가는 타이밍 속 다사다난한 그들의 첫사랑 연대기는 계속된다!",https://serieson.naver.com/v2/movie/248701
클래식,"같은 대학에 다니는 지혜(손예진 분)와 수경(이수인 분)은 연극반 선배 상민(조인성 분)을 좋아한다. 하지만 호들갑스런 수경이 상민에게 보낼 편지의 대필을 부탁하고, 지혜는 수경의 이름으로 상민을 향한 자신의 감정을 고백한다. 지혜의 편지로 맺어진 수경과 상민이 가까워지면서 지혜는 괜한 죄의식에 상민을 멀리 하려 하지만, 우연하게도 자꾸만 마주치게 된다. 한편, 아빠를 일찍 여읜 지혜는 지금은 해외 여행 중인 엄마 주희와 단둘이 살다. 엄마의 빈자리를 털기 위해 다락방을 청소하던 지혜는 우연히 엄마의 비밀 상자를 발견하게 된다. 주희의 첫사랑의 기억이 고스란히 담겨있는 비밀 상자를 보면서 지혜는 엄마의 클래식한 사랑을 조금씩 알게 된다. 1968년 여름... 방학을 맞아 시골 삼촌댁에 간 준하(조승우 분)는 그곳에서 성주희(손예진 분)를 만나, 한눈에 그녀에게 매료된다. 그런 주희가 자신에게만 은밀하게 '귀신 나오는 집'에 동행해줄 것을 부탁해온다. 흔쾌히 수락한 준하는 흥분된 마음을 가까스로 누르며 주희와의 약속 장소에 나간다. 그런데 갑작스런 소나기를 만나 배가 떠내려가면서 귀가 시간이 늦어지고, 이 일로 주희는 집안 어른에게 심한 꾸중을 듣고 수원으로 보내진다. 작별 인사도 못하고 헤어진 주희를 향한 준하의 마음은 안타깝기만 하다. 그렇게 방학이 끝나고 학교로 돌아온 준하는 친구 태수에게 연애편지의 대필을 부탁받는데, 상대가 주희란 사실에 깜짝 놀란다. 하지만 태수에게 그 사실을 말하지 못하고, 태수의 이름으로 자신의 마음을 담아 주희에게 편지를 쓴다. 편지를 대신 써주며 사랑이 깊어간 엄마와 자신의 묘하게도 닮은 첫사랑. 이 우연의 일치에 내심 의아해하는 지혜는 상민에 대한 생각이 더욱 깊어만 간다. 하지만 이미 친구의 연인이 되어버린 그를 포기하기로 마음먹는데...",https://serieson.naver.com/v2/movie/754
소셜 네트워크,"5억 명의 ‘친구’가 생긴 순간 진짜 친구들은 적이 되었다! 2003년 가을, 하버드대의 컴퓨터 천재 ‘마크’는 비밀 엘리트 클럽의 윈클보스 형제에게 하버드 선남선녀들만 교류할 수 있는 ‘하버드 커넥션’ 사이트 제작을 의뢰 받는다. 하지만 여기서 획기적인 아이디어를 생각해낸 ‘마크’는 인맥 교류 사이트 ‘페이스북’을 개발, 절친 ‘왈도’의 도움으로 사이트를 오픈한다. ‘페이스북’은 순식간에 모두의 마음을 사로잡고, 유명한 냅스터의 창시자 ‘숀’의 참여로 전세계로 번지면서 ‘마크’는 기업가치 58조원, 전세계 최연소 억만장자가 된다. 하지만 그 순간 윈클보스 형제는 물론 ‘왈도’마저 전대미문의 소송을 제기하면서 하버드 천재들간의 치열한 아이디어 전쟁이 시작되는데…",https://serieson.naver.com/v2/movie/59390
이미테이션 게임,"매 순간 3명이 죽는 사상 최악의 위기에 처한 제 2차 세계대전. 절대 해독이 불가능한 암호 ‘에니그마’로 인해 연합군은 속수무책으로 당하게 된다. 결국 각 분야의 수재들을 모아 기밀 프로젝트 암호 해독팀을 가동한다. 천재 수학자 앨런 튜링(베네딕트 컴버배치)은 암호 해독을 위한 특별한 기계를 발명하지만 24시간 마다 바뀌는 완벽한 암호 체계 때문에 번번히 좌절하고 마는데... 과연, 앨런 튜링과 암호 해독팀은 암호를 풀고 전쟁의 승리를 끌어낼 수 있을까…?",https://serieson.naver.com/v2/movie/87856
나 홀로 집에 2 - 뉴욕을 헤매다,"시카고에 살고 있는 케빈네 가족은 크리스마스에 플로리다에 가기로 되어있다. 그러나 공항의 소란 속에, 홀로 뉴욕행 비행기에 오르게 되어 거대한 도시에 혼자 남게 된 케빈. 겁도 났지만, 한편으로 신나기도 하다. 이때 마브와 해리는 감옥을 탈출하여 한탕할 꿈에 부풀어 있다. 한편 케빈은 기지를 발휘하여 아버지 카드로 플로리자 호텔에 부숙, 의심스러워 하는 종업원들을 멋지게 따돌린다. 케빈은 덩컨 장난감 가게에서 만난 덩컨씨에게서 뜻 깊은 계획을 듣고 작은 부금을 내미는데 그 보답으로 작은 비들기 두 개를 선물받는다. 덩컨씨는 크리스마스때 벌은 돈을 어린이 병원에 기부하려하고 있다. 그러나 공교롭게 마브와 해리가 이 기부금을 노리고 있을 줄이야. 케빈은 덩컨가게 앞에서 마브와 해리를 만나 쫓기게 되고, 설상가상으로 케빈의 카드를 추적한 호텔직원의 저지를 받는다. 궁지에 몰린 케빈은 결국 마브와 해리에게 잡히게 되는데 이때 그들의 계획을 알게된다. 간신히 도망쳐 나간 케빈은 우연히 공원에서 비둘기 아줌마를 만나 친구가 된다. 그녀와의 대화에서 가족의 소중함을 깨달은 그는 자신의 잘못을 뉘우치는 의미에서 착한 일을 하겠다고 다짐한다. '불쌍한 어린이들의 돈을 뺏어가게 둘 순 없지' 케빈은 삼촌의 빈집을 이용하여 마브와 해리를 저지시킬 준비에 들어간다. 드디어 케빈은 가게에 숨어든 마브와 해리의 범죄현장을 카메라로 잡고 그들을 빈집으로 유인한다. 케빈의 함정에 빠져 혼이난 두 멍청한 도둑들은 결국 공원에서 케빈의 신고로 출동한 경찰에 잡히고 만다. 드디어 카드를 추적하여 케빈을 찾아온 어머니와도 극적인 상봉을 하고 다음날 케빈을 비롯해 가족 모두를 기다리는것이 있었으니, 바로 케빈의 선행에 보답하는 덩컨씨의 크리스마스 선물들이었다. 케빈은 외로운 비둘기 아줌마에게 비둘기 인형 한 개를 선물하여 영원한 우정을 약속한다.",https://serieson.naver.com/v2/movie/71884
나 홀로 집에 3,"미 국방부는 일급 기밀 컴퓨터 칩을 도난당한다. 전문적이고 무자비한 절도 행위를 자행해온 국제 범죄 조직이 블랙 마켓에서 이 컴퓨터 칩을 대가로 수백만 달러를 요구하고 있다. 이 무자비한 범죄조직의 악당들은 무선 조정 자동차에 숨겨서 공항을 빠져 나오던 중 가방이 할머니 것과 바뀌는 사건이 발생한다. 일당들은 공항에서 할머니의 집까지 태워준 택시 기사를 협박하여 할머니의 집을 알아내지만 막상 할머니 집에 도착에 동네 전체 14 가구 모두가 운전 기사가 묘사한 집과 똑같았다. 이제부터 네명의 능숙한고 고도의 훈련으로 무장한 국제 범죄자들은 컴퓨터 칩을 찾기 위한 계획적이고 치밀한 수색작업에 들어가는데 경찰과 인터폴, FBI도 이들의 작전을 막을 수 없다. 알렉스 프루이트(Alex: 알렉스 D. 린즈 분)는 상상력이 풍부한 8살 짜리 꼬마이다. 가족 모두는 휴가를 보내러 집을 비우게 되고, 수두를 앓느라 집에 혼자 남겨진 알렉스는 무료함을 달래기 위해 동네를 망원경으로 관찰하던 중 수상한 사람들을 발견하고 이들의 음모에 대응하기로 결심하게 된다.",https://serieson.naver.com/v2/movie/71882
머니볼,"게임의 역사를 바꾼 감동의 리그가 시작된다! 메이저리그 만년 최하위에 그나마 실력 있는 선수들은 다른 구단에 뺏기기 일수인 ‘오클랜드 애슬레틱스’. 돈 없고 실력 없는 오합지졸 구단이란 오명을 벗어 던지고 싶은 단장 ‘빌리 빈(브래드 피트)’은 경제학을 전공한 ‘피터’를 영입, 기존의 선수 선발 방식과는 전혀 다른 파격적인 ‘머니볼’ 이론을 따라 새로운 도전을 시작한다. 그는 경기 데이터에만 의존해 사생활 문란, 잦은 부상, 최고령 등의 이유로 다른 구단에서 외면 받던 선수들을 팀에 합류시키고, 모두가 미친 짓이라며 그를 비난한다. 과연 빌리와 애슬레틱스 팀은 ‘머니볼’의 기적을 이룰 수 있을까?",https://serieson.naver.com/v2/movie/48349
내가 처음으로 사랑한 소녀,"12년 내내 여학교를 다니며 학생대표를 해오던 윙(담선언),그리고 그녀의 유일한 친구 실비아(양시영).두 사람은 어느 순간 친구 이상의 감정을 느끼고특별한 시간들을 보내며 미래를 약속하지만, 곱지 않은 주변의 시선과 상황들로 결국 둘은 이별을 택한다. 몇 년의 시간이 흐른 어느 날, 각자의 삶을 살아가던 두 사람은 한 통의 전화로 다시 만나게 되는데.. 평생 함께하자던 소울메이트였던 그들, 그때 너도 나와 같은 마음이었을까?",https://serieson.naver.com/v2/movie/497762
매트릭스 2 - 리로디드,"1편의 엔딩 크레딧과 함께 인류를 구원해야 하는 자신의 운명을 받아들이며 하늘로 날아오른 네오(키아누 리브스). 내일 이 전쟁이 끝난다면, 한번 싸워 볼만하지 않을까...? 목숨도 걸어 볼만 하지 않을까...? 모피어스(로렌스 피쉬번)와 트리니티(캐리-앤 모스)가 전에 자신에게 던졌던 질문을 스스로에게 던져보는 네오는 마침내, 중대한 결정을 내린다. 시온이 컴퓨터 군단에게 장악될 위기에 처하면서, 네오는 자신의 능력에 대한 더 큰 통제력을 갖게 된다. 이제 몇시간 후면 지구상에 남은 인류 최후의 보루인 시온이 인간 말살을 목적으로 프로그래밍 된 센티넬 무리에 의해 짓밟히게 될 터... 그러나 시온의 시민들은 오라클의 예언이 이루어져 전쟁이 끝날 것이라는 모피어스의 신념에 용기를 얻고, 네오에게 모든 희망과 기대를 걸어보기로 한다. 서로에 대한 사랑의 힘으로, 스스로에 대한 믿음으로 용기를 얻은 네오와 트리니티는 모피어스와 함께 인간을 억압하고 착취하는 시스템에 맞서기 위해 '매트릭스'로 돌아간다. 그리고, 수소문 끝에 매트릭스의 심장부로 그들을 안내할 '키메이커'의 행적을 찾아낸 트리니티와 모피어스. 하지만, '키메이커'는 신출귀몰한 악당 트윈스에게 철저하게 감시당하고 있다. 시스템에 대항하기 위해 '키메이커' 구출이라는 위험한 임무를 감행하는 세 사람. 한편, 에이전트 스미스(휴고 위빙)는 네오에 대한 불타는 복수심으로 시스템에 불복종하게 되고, 그 결과 삭제될 위기에 처한다. 이제 그는 도망자의 신세가 되어, 계속 네오를 추적한다. 한때 자신이 그토록 경멸했던 인간성을 어느새 자기 자신도 갖게된 스미스는 복수를 위해 수단 방법을 가리지 않는데... '매트릭스'의 내부 구조로 깊이 들어갈수록, 그리고, 인류의 운명을 좌우할 자신의 역할에 눈 떠 갈수록, 네오는 더 큰 저항과 더 무서운 진실에 직면하게 된다. 그리고 상상할 수 없는 불가능에 가까운 선택을 강요 받는다. 사랑과 신념, 목적과 명분... 이 모든 것의 합류점에서 네오는 자신이 택한 길을 따라가야 한다. 그는 자문한다. '만약 내가 못해낸다면...?' '만약 실패한다면...?' 대답은 한가지 뿐이다. 시온이 멸망할 것이라는 것. 그리고 마침내... 인류의 운명을 건 필사의 전투가 시작된다!!",https://serieson.naver.com/v2/movie/2742
매트릭스 3 - 레볼루션,"2199년, 시스템이 인간을 지배하는 세상. 인간들은 태어나자마자 인공 자궁 안에 갇혀 기계들의 생명 연장을 위한 에너지로 사용되고 뇌세포에 매트릭스라는 프로그램을 입력 당해 평생 기계에 의해 설정된 가상 현실을 살아간다. 가상 현실의 꿈에서 깨어난 인간들은 '시온'이라는 세상을 건설하고 인류를 구원할 영웅 '그'를 찾아 나선다. 마침내 발견한 '그'는 낮에는 평범한 회사원으로 밤에는 '네오'라는 이름으로 컴퓨터 해킹을 하는 컴퓨터 프로그래머, 토마스 앤더슨(키아누 리브스). 앤더슨은 트리니티(캐리 앤 모스)라는 여인에게 이끌려 매트릭스 밖의 우주를 만나면서 모든 진실과 직면하게 된다. 숨겨진 진실을 알게 된 앤더슨은 이제 '네오'라는 이름으로 인류를 구원해야 하는 자신의 운명을 받아들이게 된다. '시온'은 센티넬이라는 기계군단에게 장악될 위기에 처하고, 자신의 능력에 대한 더 큰 통제력을 갖게 된 네오는 인류의 구원을 위해 트리니티, 모피어스(로렌스 피쉬번)와 함께 시스템에 맞서게 된다. '매트릭스'의 내부 구조로 깊이 들어갈수록, 인류의 운명을 좌우할 자신의 역할에 눈 떠가던 네오는 '설계자'를 만나 자신의 존재가 설계자에 의해 만들어진 통제 시스템에 불과하다는 충격적인 진실에 직면한다. 그리고 '사랑인가, 인류의 구원인가!'라는 불가능에 가까운 선택을 강요 받는 네오. 둘 중 하나는 포기해야 한다! 진실을 찾는 여정에 한걸음 더 접근하게 된 네오. 그러나 그 와중에 능력을 소진하고 매트릭스와 현실세계의 중간계를 떠돌게 된다. 한편, 기계들이 인간말살을 목적으로 인류 최후의 보루 '시온'으로 침공해오자 인간들은 인류의 미래를 지키기 위해 필사적인 전투를 벌인다. 그러나 베인의 몸 속에 침투한 에이전트 스미스(휴고 위빙)가 본 모습을 드러내면서 네오에게는 예기치 못한 새로운 변수가 생긴다. 매순간 세력이 커져가면서 기계들의 통제권까지 벗어난 스미스는 현실 세계와 매트릭스는 물론 기계도시까지 말살할 야욕을 불태운다. 이에 네오에게 마지막 조언을 건네는 오라클(매리 앨리스). 네오는 오라클 역시 매트릭스라는 거대한 구조 속에 존재하는 하나의 프로그램에 불과할 수 있음을 알면서도 그녀의 조언을 받아들인다. 니오베(제이다 핀켓 스미스)의 도움으로 네오와 트리니티는 일찍이 그 어느 인간도 가본적이 없는 세계, 기계 도시의 심장부로 잠입한다. 그곳에서 기계 세상의 절대 권력자(DEUS EX MACHINA)를 만나 파멸 직전의 인류를 구원키 위한 최후의 카드를 던지는데... 이제 드디어 인류 최후의 거대한 진실이 그 베일을 벗는다!",https://serieson.naver.com/v2/movie/2739
매트릭스: 리저렉션,"토마스 앤더슨은 ‘자신’의 현실이 물리적 구성개념인지 아니면 정신적 구성개념인지 알아내기 위해 이번에도 흰 토끼를 따라가야 한다. 토마스, 아니 네오가 배운 게 있다면 비록 환상이라 할지라도 선택이야말로 매트릭스를 탈출할 유일한 길이라는 것이다. 물론 네오는 무엇을 해야 할지 이미 알고 있다. 그가 아직 모르는 사실은 이 새로운 버전의 매트릭스가 그 어느 때보다도 강력하고, 확고부동하고, 위험하다는 것이다. 평범한 일상과 그 이면에 놓여 있는 또 다른 세계, 두 개의 현실이 존재하는 세상에서 운명처럼 인류를 위해 다시 깨어난 구원자 네오. 빨간 약과 파란 약 중 어떤 것을 선택할 것인가?",https://serieson.naver.com/v2/movie/480984
극장판 짱구는 못말려: 동물소환 닌자 배꼽수비대,"어느 날 ‘짱구‘와 동갑내기인 5살 ‘진구’를 데리고, 짱구 가족을 찾아온 수상한 여성. 서로의 아이가 바뀌었다는 충격적인 소식을 전한다. 하루아침에 닌자 가문의 후계자 ‘진구’로 불리게 된 짱구는 ‘부리부리 엉덩이 분신술’로 닌자 유치원을 초토화시킨다. 한편, 떡잎마을에 남겨진 진구와 짱구 가족은 짱구를 찾으러 닌자 마을로 향하고, 세상의 중심인 ‘지구의 배꼽’이 흔들리기 시작하며, 지구가 붕괴될 위기에 처하는데… 과연 짱구는 세상을 지켜낼 수 있을까?!",https://serieson.naver.com/v2/movie/571818
극장판 짱구는 못말려: 격돌! 낙서왕국과 얼추 네 명의 용사들,"아이들의 낙서가 사라져 붕괴 위기에 처한 낙서왕국은 낙서 에너지를 모으기 위해 지구 침공을 시작한다. 낙서왕국의 위험한 작전을 막기 위해 지상의 용사로 선택 받은 짱구는 그림에 생명을 불어넣는 ‘미라클 크레용’을 얻게 된다. 쓰윽 쓰윽~ 그려 그려~! 짱구가 미라클 크레용으로 그림을 그리자 브리프, 가짜 이슬이 누나, 부리부리 용사가 스케치북 밖으로 튀어나오는데..! 과연, 크레용 용사 짱구는 낙서 용사들과 함께 위험에 빠진 떡잎마을과 세계를 구할 수 있을까?!",https://serieson.naver.com/v2/movie/465008
극장판 짱구는 못말려: 신혼여행 허리케인~ 사라진 아빠!,"아름다운 호주의 한 섬으로 신혼여행을 떠난 짱구네 가족. 즐거운 시간도 잠시, 수수께끼 원주민 가면족에게 사로잡혀 아빠가 사라진다. 이 섬에는 50년에 한 번 엄청난 보물을 얻을 수 있다는 전설이 있는데, 그 보물을 여는 열쇠가 바로 아빠라고? 여기에 보물을 노리는 트레저 헌터들까지 합세해 치열한 아빠 쟁탈전이 벌어지는데...! 위기에 처한 짱구네 가족은 무사히 아빠를 되찾을 수 있을까?",https://serieson.naver.com/v2/movie/468810
극장판 짱구는 못말려 24기 - 폭풍수면! 꿈꾸는 세계 대돌격,"어느 날, 꿈 속에서 거대한 물고기가 나타나 짱구 가족을 한 입에 삼킨 날로부터 마을 사람들은 모두 잠을 잘 때마다 보고 싶은 꿈을 꾸는 신기한 꿈의 세계로 가게 된다. 하지만 짱구의 유치원에 ‘보라’가 전학 온 후, 마을 사람들이 꿈꾸는 세계는 점차 악몽으로 변해가고 사람들은 무시무시한 악몽 속으로 빨려 들어가게 된다. 짱구와 떡잎마을 방위대는 새롭게 전학 온 보라가 꿈의 세계 속 비밀을 간직하고 있다는 것을 알게 되고, 마을 사람들과 보라를 위해 악몽과의 한판 대결을 시작하는데…",https://serieson.naver.com/v2/movie/498456
극장판 짱구는 못말려 : 습격!! 외계인 덩덩이,"짱구의 엉덩이에 지구의 운명이 걸렸다! 짱구의 집에 불시착한 UFO의 주인 외계인 ‘덩덩이’. ‘나스파디’ 별에서 온 ‘덩덩이’는 무시무시한 ‘꼬마꼬마 파워’로 짱구의 엄빠를 어린이로 만들어버린다! 엄빠를 다시 어른으로 되돌리기 위해 ‘덩덩이’의 아빠를 만나러 떠나지만 연락이 닿지 않고, 심지어 지구를 위협하는 외계인의 음모까지 드러나기 시작하는데…!!! 짱구의 엉덩이에 숨은 외계인 ‘덩덩이’와 가족들의 스펙터클한 대모험이 펼쳐진다!",https://serieson.naver.com/v2/movie/468808
알라딘,"머나먼 사막 속 신비의 아그라바 왕국의 시대. 좀도둑 ‘알라딘’은 마법사 ‘자파’의 의뢰로 마법 램프를 찾아 나섰다가 주인에게 세 가지 소원을 들어주는 지니를 만나게 되고, 자스민 공주의 마음을 얻으려다 생각도 못했던 모험에 휘말리게 되는데…",https://serieson.naver.com/v2/movie/320877
극장판 짱구는 못말려 22기 - 정면승부! 로봇아빠의 역습,"어느 날, 로봇이 되어 돌아온 짱구 아빠! 짱구는 그 동안 영화에서만 봤던 슈퍼히어로가 되어 특별한 능력을 보여주는 로봇 아빠가 자랑스럽다. 그러나 갑자기 무시무시한 모습으로 변하는 로봇 아빠와 함께 떡잎마을을 무너뜨리려는 거대한 음모가 드러나는데… 과연, 로봇 아빠와 짱구 가족은 마을의 평화를 지켜낼 수 있을까? 가족의 운명을 건 거대한 전쟁이 시작된다!",https://serieson.naver.com/v2/movie/498454
극장판 짱구는 못말려: 아뵤! 쿵후 보이즈 ~라면 대란~,"중독 위험! 세계를 지배하려는 ‘블랙판다 라면’이 나타났다! 전설의 쿵후 ‘말랑말랑권’으로 세계 평화를 지켜야 한다! 몸도 마음도 말랑말랑한 짱구와 떡잎마을 방범대 출동! 짱구와 친구들이 살고 있는 떡잎마을에 있는 중국인 거리 아이야 타운 그곳에 나타난 블랙판다 라면 사장 돈빵빵은 오직 라면을 위한, 라면에 의한 블랙판다 라면 빌딩을 세우려 한다! 블랙판다 라면을 먹고 점점 난폭해지는 사람들! 앗! 짱아도 블랙판다 라면을 먹어버렸다…! 세계의 평화를 위해 지금 필요한 건 바로 전설의 쿵후 말랑말랑권! 쿵후 소녀 란과 함께 말랑말랑권의 9가지 기술을 터득한 뒤, 중국에서 마지막 신공을 얻어야 한다! 짱구와 떡잎마을 방범대 친구들은 세계 평화를 지켜낼 수 있을까?",https://serieson.naver.com/v2/movie/468812
극장판 짱구는 못말려 23기 - 나의 이사 이야기 선인장 대습격,"안녕… 떡잎마을… 갑자기 멕시코 지사로 발령이 난 짱구아빠. 그로 인해 짱구 가족은 정든 떡잎마을을 떠나 멕시코로 이사를 가게 되고, 태양의 나라 멕시코에 도착한 짱구 가족은 선인장 페스티벌에 참여하게 되는데... 하지만 짱구 가족을 기다리는 건 선인장 괴물?! 과연 짱구와 멕시코 이웃들은 무시무시한 선인장 괴물에 맞서 마을을 지켜낼 수 있을까? 가족의 운명을 건 선인장 괴물과의 후끈한 한 판 승부가 시작된다!",https://serieson.naver.com/v2/movie/498455
